Therefore a   therapeutic window   was chosen and patients received a single dose of DNR either as 1-h or  24-h  infusion  one  week  before  the  start  of  induction  therapy.,therapeutic window chosen patients received single dose dnr 1-h 24-h infusion week start induction therapy,C0087111|C0557702|C1707391|C0030705|C1514756|C0037179|C0178602|C0011015|C0033727|C0450371|C0574032|C0332174|C0439659|C0205263|C0039798
Patients were randomized to placebo or enoximone at 25 or 50 mg orally three times a day.,patients randomized placebo enoximone 25 50 orally times day,C0030705|C0034656|C0032042|C0116190|C0450371|C0450371|C0442027|C0040223|C0332173
"In EBM group, a swab soaked in EBM was kept in the babys mouth for 2 minutes before the removal of  the intervention.",ebm swab soaked ebm babys mouth 2 minutes removal intervention,C0795974|C0183753|C0204774|C0795974|G0000000|C0226896|G0000000|C0439232|C0015252|C0886296
"We randomly assigned 1010 women with axillary-nodepositive or high-risk nodenegative cancer to receive three cycles of docetaxel or vinorelbine, followed by (in  both groups) three cycles of fluorouracil, epirubicin, and cyclophosphamide.",randomly assigned 1010 women axillary-nodepositive high-risk nodenegative cancer receive cycles docetaxel vinorelbine cycles fluorouracil epirubicin cyclophosphamide,G0000000|C1516050|G0000000|C0043210|C0004454|C0332167|G0000000|C0006826|C1514756|C1511572|C0246415|C0078257|C1511572|C0016360|C0014582|C0010583
We enrolled 25 patients each in the carvedilol and control groups.,enrolled 25 patients carvedilol control,G0000000|C0450371|C0030705|C0054836|C0243148
"In line with current recommendations [5] patients were also encouraged to exercise at home, building up to five sessions a week.",current recommendations 5 patients encouraged exercise building sessions week,C0521116|C0034866|G0000000|C0030705|G0000000|C0015259|C1547706|C1883016|C0332174
"In 2 of 7 PCI patients with a complication, a glycoprotein IIa IIIb inhibitor had been used, while glycoprotein IIa IIIb inhibitors were used in 9/72 patients without access site complication (P 5 n.s.).",2 7 pci patients complication glycoprotein iia iiib inhibitor glycoprotein iia iiib inhibitors 9/72 patients access site complication 5 ns,G0000000|G0000000|C4049621|C0030705|C0009566|C0017968|G0000000|G0000000|C1999216|C0017968|G0000000|G0000000|C0243077|C0450371|C0030705|C0444454|C0205145|C0009566|G0000000|C0038944
"Patients fulfilling all entry criteria were randomized to twice-daily dosing with placebo, low-dose carvedilol (target dose of 0.2 mg/kg per dose if weight 62.5 kg or 12.5 mg per dose if weight 62.5 kg) or high-dose carvedilol (target dose of 0.4 mg/kg per dose if weight 62.5 kg or 25 mg per dose if weight 62.5 kg) in a double-blind manner following a ratio of 1:1:1.",patients fulfilling entry criteria randomized twice-daily dosing placebo low-dose carvedilol target dose 02 mg/kg dose weight 625 125 dose weight 625 high-dose carvedilol target dose 04 mg/kg dose weight 625 25 dose weight 625 double-blind manner ratio 111,C0030705|C1550543|C1705654|C0243161|C0034656|C0585361|G0000000|C0032042|C0445550|C0054836|C1521840|C0178602|C0450371|C0439272|C0178602|C0005910|C1442061|C1442061|C0178602|C0005910|C1442061|C0444956|C0054836|C1521840|C0178602|C0450371|C0439272|C0178602|C0005910|C1442061|C0450371|C0178602|C0005910|C1442061|C0013072|G0000000|C0456603|C1442061
"Between March 2013March 2014 a total of 55 patients agreed to participate in the study, of which 26 were allocated to the CT group and 29 to the HT group.",march 2013march 2014 total 55 patients agreed participate study 26 allocated ct 29 ht,C3829202|G0000000|G0000000|C0439175|C0450371|C0030705|C3641827|G0000000|C0557651|C0450371|G0000000|C0007673|C0450371|C0018510
"Intervention The text messagebased prevention program involved delivery of regular semipersonalized text messages (some messages personally addressed through a mail-mergetype function with the participants preferred name) providing advice, motivation, and information that aimed to improve diet, increase physical activity, and encourage smoking cessation (if relevant).",intervention text messagebased prevention program involved delivery regular semipersonalized text messages messages personally addressed mail-mergetype function participants preferred providing advice motivation aimed improve diet increase physical activity encourage smoking cessation relevant,C0886296|C1527021|G0000000|C0199176|C1709697|C1314939|C0011209|C0205272|G0000000|C1527021|C0470166|C0470166|G0000000|C0376649|C0024492|C0031843|C0679646|C0558295|C1999230|C0150600|C0026605|C1947946|G0000000|C0012155|C0442805|C0031809|C0205177|G0000000|C0037369|C1880019|C2347946
This could be due to staff encouragement of patients to exercise at their target heart rate for the full prescribed duration in the supervised setting.,staff encouragement patients exercise target heart rate prescribed duration supervised setting,C0851286|C0870494|C0030705|C0015259|C1521840|C0018787|C0871208|C0278329|C0449238|G0000000|C0542559
Patients with Ischaemic Heart Disease were randomised to receive either aspirin 325 mg or warfarin.,patients ischaemic heart disease randomised receive aspirin 325 warfarin,C0030705|C0475224|C0018787|C0012634|G0000000|C1514756|C0004057|C1442061|C0043031
"Patients and methods: From October 2000 until June 2005, 1121 node-positive patients were randomized to sequential dose-dense epirubicin 110 mg/m2 and paclitaxel (Taxol, Bristol Myers-Squibb, Princeton, New Jersey, USA) 250 mg/m2 (group A), or concurrent epirubicin 83 mg/m2 and paclitaxel 187 mg/m2 (group B), both followed by three cycles of intensied combination chemotherapy with cyclophosphamide, methotrexate and uorouracil (CMF).",patients methods october 2000 june 2005 1121 node-positive patients randomized sequential dose-dense epirubicin 110 mg/m2 paclitaxel taxol bristol myers-squibb princeton jersey usa 250 mg/m2 concurrent epirubicin 83 mg/m2 paclitaxel 187 mg/m2 cycles intensied combination chemotherapy cyclophosphamide methotrexate uorouracil cmf,C0030705|C0025663|C3828732|G0000000|C3829443|G0000000|G0000000|C0746319|C0030705|C0034656|C1548958|C0178602|C0014582|C1442061|C0026410|C0144576|C0678133|G0000000|C0331904|C0331889|C0454673|C0041703|C1442061|C0026410|C0205420|C0014582|C0450371|C0026410|C0144576|C1442061|C0026410|C1511572|G0000000|C0205195|C0013216|C0010583|C0025677|G0000000|C0950521
"As part of the routine management, all  infants received three doses of methylprednisolone, 8 h apart, starting  the night before surgery.",routine management infants received doses methylprednisolone 8 starting night surgery,C0205547|C0001554|C0021270|C1514756|C0178602|C0025815|G0000000|C0439659|C0240526|C0038894
"Radial artery cannulation was performed as previously described. To summarise, the right radial puncture was performed under local anaesthesia (subcutaneous 1 ml of 2% lidocaine) using a 20-gauge needle and a 0.022 inch hydrophilic guide-wire.",radial artery cannulation performed summarise radial puncture performed local anaesthesia subcutaneous 1 2% lidocaine 20-gauge needle 0022 inch hydrophilic guide-wire,C0442038|C0003842|C0917707|C0884358|G0000000|C0442038|C0033119|C0884358|C0205276|C0002903|C0443315|G0000000|G0000000|C0023660|C0450371|C0027551|G0000000|C0439204|C0475370|C0181089
"intervention  components  include patient assessment, care planning,  routine nurse monitoring, patient self-monitoring,  education,  care  coordination,  and  service  arrangement.",intervention components patient assessment care planning routine nurse monitoring patient self-monitoring education care coordination service arrangement,C0886296|C0449432|C0030705|C1261322|C1947933|C0032074|C0205547|C0028661|C0150369|C0030705|C0588436|C0013621|C1947933|C0242414|C0557854|C0449830
Amifostine was administered to 15 patients (740 mg/m2/dose) as a 15-min intravenous infusion immediately prior to any cisplatin administration.,amifostine administered 15 patients 740 mg/m2/dose 15-min intravenous infusion prior cisplatin administration,C0015020|C1521801|C0450371|C0030705|C1442061|C0026410|C0450371|C0348016|C0574032|C0332152|C0008838|C0001554
Regimens consisted of either doxorubicin (60 mg/m2) and cyclophosphamide (600 mg/m2) every 21 days for four cycles followed by paclitaxel (175 mg/m2) every 3 weeks for four cycles (arm 1) or the same chemotherapy plus weekly trastuzumab starting with the rst dose of paclitaxel at a loading dose of 4 mg/kg followed by 2 mg/kg for 51 weeks (arm 2).,regimens consisted doxorubicin 60 mg/m2 cyclophosphamide 600 mg/m2 21 days cycles paclitaxel 175 mg/m2 3 weeks cycles arm 1 chemotherapy weekly trastuzumab starting rst dose paclitaxel loading dose 4 mg/kg 2 mg/kg 51 weeks arm 2,C2945654|C0332529|C0013089|C0450371|C0026410|C0010583|C1442061|C0026410|C0450371|C0439228|C1511572|C0144576|C1442061|C0026410|G0000000|C0439230|C1511572|C0446516|G0000000|C0013216|C0332174|C0728747|C0439659|C1425219|C0178602|C0144576|C1708715|C0178602|G0000000|C0439272|G0000000|C0439272|C0450371|C0439230|C0446516|G0000000
"In  the  UKALL  X  trial  the  patients  received  daunorubicin  as  a  bolus injection, and in the UKALL XI trial in a 6   h infusion with  the same cumulative dose.",ukall trial patients received daunorubicin bolus injection ukall xi trial 6 infusion cumulative dose,G0000000|C0008976|C0030705|C1514756|C0011015|C1511237|C0021485|G0000000|C1720296|C0008976|G0000000|C0574032|C1511559|C0178602
"During these three sessions, patients received instructions on how to use a wearable heart rate monitor (Garmin Forerunner 70) and how to upload the recorded exercise data to a web application (Garmin Connect) through the Internet.",sessions patients received instructions wearable heart rate monitor garmin forerunner 70 upload recorded exercise data web application garmin connect internet,C1883016|C0030705|C1514756|C0302828|G0000000|C0018787|C0871208|C0030695|G0000000|G0000000|C0450371|C1710578|C0034869|C0015259|C1511726|C0282111|C0185125|G0000000|C2986575|C0282111
"Patients were randomly assigned to receive either (arm I) AC given in combination (AC) doxorubicin 54 mg/m2 and cyclophosphamide 1.2 g/m2 intravenously (IV) every 3 weeks for six cycles or (arm II) in sequence (A 3 C) doxorubicin 40.5 mg/m2 IV days 1 and 2 of a 21-day cycle for four cycles, followed by cyclophosphamide 2.4 gm/m2 IV every 2 weeks for three cycles.",patients randomly assigned receive arm ac combination ac doxorubicin 54 mg/m2 cyclophosphamide 12 g/m2 intravenously iv 3 weeks cycles arm ii sequence 3 doxorubicin 405 mg/m2 iv days 1 2 21-day cycle cycles cyclophosphamide 24 gm/m2 iv 2 weeks cycles,C0030705|G0000000|C1516050|C1514756|C0446516|C0003354|C0205195|C0003354|C0013089|C0450371|C0026410|C0010583|C0450371|C0439267|G0000000|C0022326|G0000000|C0439230|C1511572|C0446516|G0000000|C0004793|G0000000|C0013089|C1442061|C0026410|C0022326|C0439228|G0000000|G0000000|C0450371|C1511572|C1511572|C0010583|C0450371|C0017480|C0022326|G0000000|C0439230|C1511572
"We  randomly  assigned  patients  candesartan (n=1276,  target  dose  32  mg  once  daily)  or  placebo (n=1272).",randomly assigned patients candesartan n=1276 target dose 32 daily placebo n=1272,G0000000|C1516050|C0030705|C0717550|C0369718|C1521840|C0178602|C0450371|C0332173|C0032042|C0369718
Patients and Methods High-risk node-negative or low-risk node-positive breast cancer patients received AC given: (arm I) concurrently (AC) doxorubicin 54 mg/m2 and cyclophosphamide 1.2 g/m2 intravenously (IV) every 3 weeks for six cycles; or (arm II) in sequence (A 3 C) doxorubicin 40.5 mg/m2 IV days 1 and 2 every 3 weeks for four cyles followed by cyclophosphamide 2.4 gm/m2 IV every 2 weeks for three cycles.,patients methods high-risk node-negative low-risk node-positive breast cancer patients received ac arm concurrently ac doxorubicin 54 mg/m2 cyclophosphamide 12 g/m2 intravenously iv 3 weeks cycles arm ii sequence 3 doxorubicin 405 mg/m2 iv days 1 2 3 weeks cyles cyclophosphamide 24 gm/m2 iv 2 weeks cycles,C0030705|C0025663|C0332167|C0678034|C3272281|C0746319|C0006141|C0006826|C0030705|C1514756|C0003354|C0446516|G0000000|C0003354|C0013089|C0450371|C0026410|C0010583|C0450371|C0439267|G0000000|C0022326|G0000000|C0439230|C1511572|C0446516|G0000000|C0004793|G0000000|C0013089|C1442061|C0026410|C0022326|C0439228|G0000000|G0000000|G0000000|C0439230|G0000000|C0010583|C0450371|C0017480|C0022326|G0000000|C0439230|C1511572
"All patients received the same intravenous neoadjuvant  chemotherapy regimen, consisting of several non-crossresistant cytotoxic agents: doxorubicin 60 mg/m (given  rst)  plus  paclitaxel  150  mg/m  infused  during  3  h,  every  3  weeks  for  three  cycles,  followed  by  paclitaxel  175  mg/m  administered  every  3  weeks  for  four  cycles.",patients received intravenous neoadjuvant chemotherapy regimen consisting non-crossresistant cytotoxic agents doxorubicin 60 mg/m rst paclitaxel 150 mg/m infused 3 3 weeks cycles paclitaxel 175 mg/m administered 3 weeks cycles,C0030705|C1514756|C0348016|C0600558|C0013216|C0040808|C0332529|C1518422|C0677881|C0450442|C0013089|C0450371|C0026410|C1425219|C0144576|C1442061|C0026410|G0000000|G0000000|G0000000|C0439230|C1511572|C0144576|C1442061|C0026410|C1521801|G0000000|C0439230|C1511572
"After reaching the target dose (digoxin: serum level .0.9 nmol / l; propranolol: a mean heart rate of 110  120 / min) heart failure score, hemodynamic measurements by echocardiography, 24 h Holter ECG and clinical laboratory were determined.",reaching target dose digoxin serum level 09 nmol / propranolol heart rate 110 120 / min heart failure score hemodynamic measurements echocardiography 24 holter ecg clinical laboratory determined,C2584321|C1521840|C0178602|C0012265|C0229671|C0441889|C0450371|C0439191|G0000000|C0033497|C0018787|C0871208|C1442061|C1442061|G0000000|C0702093|C0018787|C0231174|C0449820|C0019010|C0242485|C0013516|C0450371|G0000000|C1623258|C0205210|C0022877|G0000000
"In the second stage of the study, the effect of KMC and  EBM  on  pain  during  removal  of  adhesive  tape  in VLBW  neonates  was  assessed.",stage study kmc ebm pain removal adhesive tape vlbw neonates assessed,C0205390|C0557651|G0000000|C0795974|C0030193|C0015252|C0001516|C0183828|C0282666|C0021289|C1516048
"Twenty-four-h Holter recordings using two-channel recorders were obtained at trial entry, after the run in phase and in those patients, who received propranolol at the end of the titration period.",twenty-four-h holter recordings two-channel recorders trial entry phase patients received propranolol titration period,C3715070|G0000000|G0000000|C0205448|C0182913|C0008976|C1705654|C0205390|C0030705|C1514756|C0033497|C0162621|C0439531
"Study 1 (80-min study, N  18) tested the effect of 80 min of KC before and throughout the heel stick procedure versus incubator care.",study 1 80-min study 18 tested 80 min kc heel stick procedure versus incubator care,C0557651|G0000000|C0450371|C0557651|C0450371|C0392366|C0450371|C0702093|C0022575|C0018870|C1706582|C0184661|G0000000|C0021178|C1947933
Patients  were  randomly  assigned  candesartan  (target  dose 32 mg once daily) or matching placebo.,patients randomly assigned candesartan target dose 32 daily matching placebo,C0030705|G0000000|C1516050|C0717550|C1521840|C0178602|C0450371|C0332173|C0150103|C0032042
Patients in the control group received usual care.,patients control received usual care,C0030705|C0243148|C1514756|C3538928|C1947933
"Nurse case managers provide education  to patients on the recognition of signs and  symptoms of their disease; how to monitor  vital  signs;  the  cause  of  diseases;  how  to  better adhere to diet, exercise, and medication regimens; and strategies to cope with  chronic illness.",nurse managers provide education patients recognition signs symptoms disease monitor vital signs diseases adhere diet exercise medication regimens strategies cope chronic illness,C0028661|C0335141|C1999230|C0013621|C0030705|C0524637|C0220912|C0683368|C0012634|C0030695|C0442732|C0220912|C0012634|C3714578|C0012155|C0015259|C0013227|C2945654|C0679199|C0009967|C0205191|C0221423
"Interventions: At weaning from cardiopulmonary bypass, either  a 24-hr infusion of 0.1 g/kg/min levosimendan or of 0.5 g/kg/min   milrinone were administered.",interventions weaning cardiopulmonary bypass 24-hr infusion 01 g/kg/min levosimendan 05 g/kg/min milrinone administered,C0886296|C0043084|C0553534|C0741847|C0450371|C0574032|C0450371|C1320758|C0246904|C0450371|C1320758|C0128513|C1521801
Psychiatric clinical nurse specialists or clinical psychology doctoral students administered the CBT intervention; all received additional training in Beck's CBT and participated in mock patient sessions prior to enrolling participants described in detail below.,psychiatric clinical nurse specialists clinical psychology doctoral students administered cbt intervention received additional training becks cbt participated mock patient sessions prior enrolling participants detail,C0205487|C0205210|C0028661|C0087009|C0205210|C0033909|C0031831|C0038492|C1521801|C0009244|C0886296|C1514756|C1524062|C0040607|G0000000|C0009244|G0000000|C0562577|C0030705|C1883016|C0332152|G0000000|C0679646|C1522508
The final study group was n=979 in the Pinard arm and n=992 in the Doppler arm.,final study n=979 pinard arm n=992 doppler arm,C0205088|C0557651|C0369718|G0000000|C0446516|C0369718|C0554756|C0446516
"Each session lasted approximately 1 h, beginning with a warm-up phase of calisthenics and stretching for 15 to 20 min, followed by 40 min of aerobic activity on a cycle ergometer, a treadmill, or both.",session lasted 1 warm-up phase calisthenics stretching 15 20 min 40 min aerobic activity cycle ergometer treadmill,C1883016|C1517741|G0000000|C2350169|C0205390|C0006759|C0600080|C0450371|C0450371|C0702093|C0450371|C0702093|C1510824|C0205177|C1511572|C0180748|C0184069
Participation in the BOA-trial did not interfere with the present study because patients were randomized to either coumarin derivates or acetylsalysilic acid.,participation boa-trial interfere study patients randomized coumarin derivates acetylsalysilic acid,C0679823|C0006506|C0521102|C0557651|C0030705|C0034656|C0010206|G0000000|G0000000|C0001128
"MAIN OUTCOMES AND MEASURES The primary outcome was a composite that included at least 1 of the following: smoking cessation, at least 3 hours per week of physical activity, at least 5% reduction in weight, and at least 4% reduction in waist circumference.",main outcomes measures primary outcome composite included 1 smoking cessation 3 hours week physical activity 5% reduction weight 4% reduction waist circumference,C0205225|C1274040|C0079809|C0205225|C1274040|C0205199|C0332257|G0000000|C0037369|C1880019|G0000000|C0439227|C0332174|C0031809|C0205177|G0000000|C0301630|C0005910|G0000000|C0301630|C0230097|C0332520
Antiarrhythmic drugs were discontinued 5 half-life periods (or 1 week for amiodarone) before ablation; antiarrhythmics were re-initiated immediately after CA for the 3-month blanking period.,antiarrhythmic drugs discontinued 5 half-life periods 1 week amiodarone ablation antiarrhythmics re-initiated 3-month blanking period,C0003195|C0013227|C1444662|G0000000|C0018517|C0439531|G0000000|C0332174|C0002598|C0547070|C0003195|C0556581|C0332177|C0750479|C0439531
"Post-operatively, patients were randomized to lifelong treatment with either acid (Aspirin) 80 mg daily or coumarin derivates (Sintrom) [target INR ratio 3.0e4.5], in accordance to local",post-operatively patients randomized lifelong treatment acid aspirin 80 daily coumarin derivates sintrom target inr ratio 30e45 local,C0687676|C0030705|C0034656|G0000000|C0039798|C0001128|C0004057|C0450371|C0332173|C0010206|G0000000|C0919378|C1521840|C0525032|C0456603|G0000000|C0205276
"Methods: Using a randomized crossover design, preterm neonates (n = 18) between 28 and 37 weeks gestational age within 10 days of life from two university-afliated level III NICUs undergoing routine heel lance were assigned to receive KC 30 min before and during the procedure from either their mother (MKC) or an unrelated woman.",methods randomized crossover design preterm neonates = 18 28 37 weeks gestational age 10 days life university-afliated level iii nicus undergoing routine heel lance assigned receive kc 30 min procedure mother mkc unrelated woman,C0025663|C0034656|C0010366|C1707689|C0151526|C0021289|G0000000|C0450371|C0450371|C0450371|C0439230|C0439671|C0001779|C0450371|C0439228|C0376558|C0041740|C0441889|C0439070|C0021709|G0000000|C0205547|C0018870|C0522666|C1516050|C1514756|C0022575|C0450371|C0702093|C0184661|C0026591|G0000000|C0445356|C0043210
Control practices provided usual care.,control practices provided usual care,C0243148|C0237607|C1999230|C3538928|C1947933
"In addition, all patients received vitamin B6 at a dose of 300 mg per day throughout the study to prevent PPE.",addition patients received vitamin b6 dose 300 day study prevent ppe,C0332287|C0030705|C1514756|C0042890|C0005558|C0178602|C1442061|C0332173|C0557651|C0309872|G0000000
"During month 1, patients followed identical regimens, including 3 ECG-monitored exercise sessions/ week, with encouragement to achieve >5 thirty-minute sessions/week.",month 1 patients identical regimens including 3 ecg-monitored exercise sessions/ week encouragement achieve 5 thirty-minute sessions/week,C0332177|G0000000|C0030705|C0205280|C2945654|C0332257|G0000000|C0180580|C0015259|C1883016|C0332174|C0870494|G0000000|G0000000|C3816446|C1883016
"All patients received heparin intra-operatively, and, in 224 limbs, the anastomoses of the bypass grafts were performed with prolene.",patients received heparin intra-operatively 224 limbs anastomoses bypass grafts performed prolene,C0030705|C1514756|C0019134|C0347985|C1442061|C0015385|C0332853|C0741847|C0332835|C0884358|C0917843
The  babies  were randomized to receive either KMC or EBM.,babies randomized receive kmc ebm,C0021270|C0034656|C1514756|G0000000|C0795974
Interventions: Patients were assigned to have minimal sternotomy access (ministernotomy) or conventional median total sternotomy.,interventions patients assigned minimal sternotomy access ministernotomy conventional median total sternotomy,C0886296|C0030705|C1516050|C0547040|C0185792|C0444454|G0000000|C0439858|C0549183|C0439175|C0185792
Control patients received standard care.,control patients received standard care,C0243148|C0030705|C1514756|C1442989|C1947933
Intervention: Intermittent FHR monitoring using Doppler.,intervention intermittent fhr monitoring doppler,C0886296|C0205267|G0000000|C0150369|C0554756
"To achieve LDL cholesterol levels of 130 mg/dl, the pravastatin dosage was increased to 40 mg/day, and nicotinic acid (1.5 to 6 g/day) and/or cholestyramine (4 to 32 g/day) were added if necessary.",achieve ldl cholesterol levels 130 mg/dl pravastatin dosage increased 40 mg/day nicotinic acid 1 5 6 g/day and/or cholestyramine 4 32 g/day,G0000000|G0000000|C0008377|C0441889|C1442061|C0439269|C0085542|C0178602|C0205217|C0450371|C0439422|C0028040|C0001128|G0000000|G0000000|G0000000|C0439417|G0000000|C0008402|G0000000|C0450371|C0439417
Women randomised to vaginal misoprostol had the tablet placed by the resident or attending physician in the vaginal vault.,women randomised vaginal misoprostol tablet resident attending physician vaginal vault,C0043210|G0000000|C0042232|C0085174|C0039225|C1320928|C1547429|C0031831|C0042232|C1550319
"Methods The women were randomised to receive 50 mg of misoprostol orally or vaginally every 6 h until the cervix was favourable for amniotomy, spontaneous rupture of membranes, or active labour occurred.",methods women randomised receive 50 misoprostol orally vaginally 6 cervix favourable amniotomy spontaneous rupture membranes active labour occurred,C0025663|C0043210|G0000000|C1514756|C0450371|C0085174|C0442027|G0000000|G0000000|C0007874|C3640814|G0000000|C0205359|C1881712|C0025255|C0205177|C0022864|C1709305
Sample size was calculated with a two-tailed alpha of 0.05 and a power of 95% to detect a 5 h difference in induction-to-delivery time.,sample size calculated two-tailed alpha 0 05 power 95% detect 5 difference induction-to-delivery time,C0370003|C0456389|C0444686|C0205448|C0439095|G0000000|C0450371|C0032863|C0450371|C0442726|G0000000|C1705241|C0205263|C0040223
All women had electronic fetal heart rate monitoring for 45 minutes prior to and following administration of each misoprostol dose.,women electronic fetal heart rate monitoring 45 minutes prior administration misoprostol dose,C0043210|C0013850|C0015965|C0018787|C0871208|C0150369|C0450371|C0439232|C0332152|C0001554|C0085174|C0178602
The vitamin C tablet was nearly identical in appearance with the misoprostol tablet and has no known effect on labor.,vitamin tablet identical appearance misoprostol tablet labor,C0042890|C0039225|C0205280|C0233426|C0085174|C0039225|C0022864
"An initial continuous CTG for 1 h was recorded, followed by intermittent CTG or continuous CTG once in active labor.",initial continuous ctg 1 recorded intermittent ctg continuous ctg active labor,C0205265|C0549178|G0000000|G0000000|C0034869|C0205267|G0000000|C0549178|G0000000|C0205177|C0022864
At the time of recruitment the women received one of the tablets and both groups re- ceived again the same drug as before misoprostol .,time recruitment women received tablets re- ceived drug misoprostol,C0040223|C2949735|C0043210|C1514756|C0039225|C0556581|G0000000|C0013227|C0085174
