Patients received cardiovascular risk factor management counseling twice per week and were invited to join a monthly support group together with family members.,patients received cardiovascular risk factor management counseling week invited join monthly support family,C0030705|C1514756|C0007226|C0035647|C1521761|C0001554|C0010210|C0332174|G0000000|G0000000|C0332177|C0183683|C0015576
"A physical therapist made home visits every other week to adjust if necessary the exercise prescription, to enhance adherence with intervention, and to record the number of completed sessions and distance cycled.",physical therapist visits week adjust exercise prescription enhance adherence intervention record completed sessions distance cycled,C0031809|C0871525|C0545082|C0332174|G0000000|C0015259|C0033080|C2349975|C1510802|C0886296|C0034869|C0205197|C1883016|C0012751|C1511572
"After full informed consent, the women were randomly allocated to receive the misoprostol orally or vaginally (May-October 2001).",informed consent women randomly allocated receive misoprostol orally vaginally may-october 2001,C1522154|C1511481|C0043210|G0000000|G0000000|C1514756|C0085174|C0442027|G0000000|C3828732|G0000000
"In a double-blind randomized controlled trial with a single dose of 200 m g misoprostol versus placebo for cervical priming at term with premature ruptune of membranes, Ngai et al .",double-blind randomized controlled trial single dose 200 misoprostol versus placebo cervical priming term premature ruptune membranes ngai al,C0013072|C0034656|C2587213|C0008976|C0037179|C0178602|C1442061|C0085174|G0000000|C0032042|C0027530|C0871133|C0233324|C0151526|G0000000|C0025255|G0000000|C0202311
"The women were then given a choice of being delivered by cesarean section, or having PGE 2 vaginal gel after a rest period.",women choice delivered cesarean pge 2 vaginal gel rest period,C0043210|C0008300|C1705822|C3841297|C0033559|G0000000|C0042232|C0017243|C0035253|C0439531
"Induction to regular contraction time was 15.6 min faster in women who received misoprostol vaginally, but not significantly different.",induction regular contraction time 15 6 min faster women received misoprostol vaginally,C0205263|C0205272|C1140999|C0040223|C0450371|G0000000|C0702093|C0015663|C0043210|C1514756|C0085174|G0000000
Methods: One hundred and six pregnant women at term with unfavorable cervix (Bishop score  4) and no contraindication to prostaglandin therapy were randomized to receive either intravaginal misoprostol 50 m g every 4 h or oral misoprostol 50 m g every 4 h for prospective randomized controlled trial study.,methods pregnant women term unfavorable cervix bishop score 4 contraindication prostaglandin therapy randomized receive intravaginal misoprostol 50 4 oral misoprostol 50 4 prospective randomized controlled trial study,C0025663|C0549206|C0043210|C0233324|C3640815|C0007874|C1551458|C0449820|G0000000|C0522473|C0033554|C0039798|C0034656|C1514756|C0442122|C0085174|C0450371|G0000000|C0442027|C0085174|C0450371|G0000000|C0023981|C0034656|C2587213|C0008976|C0557651
Patients received 50 m g of misoprostol orally or vaginally every 4 h until one of the following outcomes had occurred: cervix favorable for amniotomy; increased Bishop score  3; spontaneous rupture of membranes; or active labor.,patients received 50 misoprostol orally vaginally 4 outcomes occurred cervix favorable amniotomy increased bishop score 3 spontaneous rupture membranes active labor,C0030705|C1514756|C0450371|C0085174|C0442027|G0000000|G0000000|C1274040|C1709305|C0007874|C3640814|G0000000|C0205217|C1551458|C0449820|G0000000|C0205359|C1881712|C0025255|C0205177|C0022864
"Of the 396 patients in the study, 5 had an intrauterine death, leaving 391 women with a live fetus at term who underwent induction of labour.",396 patients study 5 intrauterine death leaving 391 women live fetus term underwent induction labour,C1442061|C0030705|C0557651|G0000000|C0694756|C0011065|G0000000|C1442061|C0043210|C1548795|C0015965|C0233324|G0000000|C0205263|C0022864
"In the misoprostol group, 118 women (58%) had vaginal deliveries and 81 (40%) had CSs.",misoprostol 118 women 58% vaginal deliveries 81 40% css,C0085174|C1442061|C0043210|C0450371|C0042232|C0011209|C0450371|C0450371|C0265338
"Three hundred and ninety-six women with term pregnancies were randomised to receive either oral or vaginal misoprostol, or dinoprostone.",ninety-six women term pregnancies randomised receive oral vaginal misoprostol dinoprostone,C3816959|C0043210|C0233324|C0032961|G0000000|C1514756|C0442027|C0042232|C0085174|C0012472
The average induction to delivery time was 17 hours in the dinoprostone group and 16 hours in the misoprostol group (p = 0.493).,average induction delivery time 17 hours dinoprostone 16 hours misoprostol = 0 493,C1510992|C0205263|C0011209|C0040223|C0450371|C0439227|C0012472|C0450371|C0439227|C0085174|G0000000|G0000000|C1442061
"The difference was not Overall, vaginal delivery was achieved in 60.8% of women (N = 226) and CS in 142 (38%).",difference vaginal delivery achieved 60 8% women = 226 cs 142 38%,C1705241|C0042232|C0011209|G0000000|C0450371|G0000000|C0043210|G0000000|C1442061|C0010182|C1442061|C0450371
"There were slightly more primiparous women in the Foley catheter/misoprostol group (44%), compared with the misoprostol group (37%) and the dinoprostone group (36%).",primiparous women foley catheter/misoprostol 44% compared misoprostol 37% dinoprostone 36%,C0033150|C0043210|G0000000|C0085590|C0450371|C1707455|C0085174|C0450371|C0012472|C0450371
"In the Foley catheter group, misoprostol was required in all but 1 case.",foley catheter misoprostol required 1,G0000000|C0085590|C0085174|C1514873|G0000000
"Routine artificial rupture of membranes to augment labour was discouraged in all three groups because of a high prevalence of hepatitis, HIV and other perinatal infections.",routine artificial rupture membranes augment labour discouraged prevalence hepatitis hiv perinatal infections,C0205547|C2004457|C1881712|C0025255|C0205217|C0022864|G0000000|C0033105|C0019158|C0019682|C0178795|C3714514
"Continuous fetal heart rate monitoring was not possible in all low-risk women, because of the shortage of cardiotocograph machines and personnel.",continuous fetal heart rate monitoring low-risk women shortage cardiotocograph machines personnel,C0549178|C0015965|C0018787|C0871208|C0150369|C3272281|C0043210|C1282927|C0179625|C0336779|C0024752
"Those women with intact membranes enrolled at the South African sites were randomly allocated to Foley catheter/oral misoprostol, oral misoprostol alone or vaginal dinoprostone.",women intact membranes enrolled south african sites randomly allocated foley catheter/oral misoprostol oral misoprostol vaginal dinoprostone,C0043210|C0205266|C0025255|G0000000|C1710133|C0027567|C0205145|G0000000|G0000000|G0000000|C0085590|C0085174|C0442027|C0085174|C0042232|C0012472
"The next in a series of opaque, sealed and numbered treatment envelopes in computergenerated random sequence was taken out of one of four dispensers for: intact membranes/unfavourable cervix, intact m e m b r a n e s / f a v o u r a b l e cervix, ruptured membranes/unfavourable cervix and ruptured membranes/favourable cervix.",series opaque sealed numbered treatment envelopes computergenerated random sequence dispensers intact membranes/unfavourable cervix intact / cervix ruptured membranes/unfavourable cervix ruptured membranes/favourable cervix,C0205549|C0029053|C0036492|C0449788|C0039798|C1622204|G0000000|C0034656|C0004793|C0180463|C0205266|C0025255|C0007874|C0205266|G0000000|C0007874|C0443294|C0025255|C0007874|C0443294|C0025255|C0007874
Group B-control group-no preoperative IABC Note: N.S-nonstatistical significant difference; LVEF-left ventricular ejection fraction.,b-control group-no preoperative iabc note s-nonstatistical difference lvef-left ventricular ejection fraction,C0243148|C0441833|C0445204|G0000000|C1316572|G0000000|C1705241|C0428772|C0018827|C0302131|C1264633
Material: Group A-IABC started prior to induction of anesthesia (n = 15); group B-no preoperative IABC (n = 15).,material a-iabc started prior induction anesthesia = 15 b-no preoperative iabc = 15,C0520510|G0000000|C1272689|C0332152|C0205263|C0002903|G0000000|C0450371|G0000000|C0445204|G0000000|G0000000|C0450371
"Patients fulfilling the inclusion criteria were randomly allocated to either of two treatment paths: Group A-therapy group-preoperative IABC therapy, started prior to induction of anesthesia, followed by continuous IABC during the entire procedure as well as postoperatively.",patients fulfilling inclusion criteria randomly allocated treatment paths a-therapy group-preoperative iabc therapy started prior induction anesthesia continuous iabc entire procedure postoperatively,C0030705|C1550543|C0007637|C0243161|G0000000|G0000000|C0039798|C0919386|C0039798|C0441833|G0000000|C0039798|C1272689|C0332152|C0205263|C0002903|C0549178|G0000000|C0439751|C0184661|G0000000
"More women in the oxytocin group were delivered vaginally in 12 hours, but there was no significant difference in the number delivered vaginally within 24 hours.",women oxytocin delivered vaginally 12 hours difference delivered vaginally 24 hours,C0043210|C0030095|C1705822|G0000000|C0450371|C0439227|C1705241|C1705822|G0000000|C0450371|C0439227
"One group received oral misoprostol 75 lg (a half and a fourth of a 100-lg tablet) at 4-hour intervals until progressive labor (defined as regular uterine contractions with cervical change), contraction frequency of at least three in 10 minutes, nonreassuring fetal heart rate tracing, or delivery occurred.",received oral misoprostol 75 lg half fourth 100-lg tablet 4-hour intervals progressive labor defined regular uterine contractions cervical change contraction frequency 10 minutes nonreassuring fetal heart rate tracing delivery occurred,C1514756|C0442027|C0085174|C0450371|C0023128|C2825407|C0205438|C1442061|C0039225|C0439227|C1272706|C0205329|C0022864|C1704788|C0205272|C0042149|C1140999|C0027530|C0392747|C1140999|C0376249|C0450371|C0439232|G0000000|C0015965|C0018787|C0871208|G0000000|C0011209|C1709305
"There was a higher rate of tachysystole in the oxytocin group (29.2% vs 14.0%); however, this difference did not reach statistical significance.",rate tachysystole oxytocin 29 2% 14 0% difference reach statistical significance,C0871208|C2985339|C0030095|C0450371|G0000000|C0450371|G0000000|C1705241|C2584321|C0038215|C0237881
STUDY DESIGN: One hundred five women were stratified by parity and randomly assigned to oral misoprostol 75 lg every 4 hours as needed to establish labor or to intravenous oxytocin.,study design women stratified parity randomly assigned oral misoprostol 75 lg 4 hours establish labor intravenous oxytocin,C0557651|C1707689|C0043210|C0205363|C0030563|G0000000|C1516050|C0442027|C0085174|C0450371|C0023128|G0000000|C0439227|C0443211|C0022864|C0348016|C0030095
Women were assigned to receive oral misoprostol or intravenous oxytocin by opening the next sequentially numbered opaque sealed envelope.,women assigned receive oral misoprostol intravenous oxytocin sequentially numbered opaque sealed envelope,C0043210|C1516050|C1514756|C0442027|C0085174|C0348016|C0030095|G0000000|C0449788|C0029053|C0036492|C1622204
Continuous electronic fetal heart rate and uterine activity monitoring were performed until uterine activity resolved or for a minimum of 1 hour after any misoprostol administration.,continuous electronic fetal heart rate uterine activity monitoring performed uterine activity resolved minimum 1 hour misoprostol administration,C0549178|C0013850|C0015965|C0018787|C0871208|C0042149|C0205177|C0150369|C0884358|C0042149|C0205177|C1514893|C1524031|G0000000|C0439227|C0085174|C0001554
"The significant difference in neonatal antibiotic administration between the two groups persisted when logistic regression analysis was performed controlling for maternal age, meconium at entry, group B streptococci colonization, interval between rupture of membranes and randomization, interval between randomization and induction, maternal fever, and epidural use.",difference neonatal antibiotic administration persisted logistic regression analysis performed controlling maternal age meconium entry streptococci colonization interval rupture membranes randomization interval randomization induction maternal fever epidural,C1705241|C1552240|C0003232|C0001554|G0000000|C0242415|C0684320|C0002778|C0884358|C2239193|C2347083|C0001779|C0025047|C1705654|C0038402|G0000000|C1272706|C1881712|C0025255|C0034656|C1272706|C0034656|C0205263|C2347083|C0015967|C0228134
"There was a trend toward more cesarean deliveries for nonreassuring fetal heart rate tracings among women allocated to receive misoprostol, but this difference was not statistically significant.",trend cesarean deliveries nonreassuring fetal heart rate tracings women allocated receive misoprostol difference statistically,C1521798|C3841297|C0011209|G0000000|C0015965|C0018787|C0871208|G0000000|C0043210|G0000000|C1514756|C0085174|C1705241|C0038215
Baseline characteristics were similar in women allocated to the two groups.,baseline characteristics women allocated,C0168634|C1521970|C0043210|G0000000
"There was no difference in the proportion of women who underwent cesarean delivery (20.1% in the misoprostol group, 19.9% in the oxytocin group).",difference proportion women underwent cesarean delivery 20 1% misoprostol 19 9% oxytocin,C1705241|C1709707|C0043210|G0000000|C3841297|C0011209|C0450371|G0000000|C0085174|C0450371|G0000000|C0030095
Seventy-six women (47.5%) who were randomly assigned to misoprostol required oxytocin augmentation of labor.,seventy-six women 47 5% randomly assigned misoprostol required oxytocin augmentation labor,C3816957|C0043210|C0450371|G0000000|G0000000|C1516050|C0085174|C1514873|C0030095|C1293122|C0022864
"STUDY DESIGN: Three hundred five women at 10 centers were randomly assigned to receive oral misoprostol, 100 lg every 6 hours to a maximum of two doses or intravenous oxytocin.",study design women 10 centers randomly assigned receive oral misoprostol 100 lg 6 hours maximum doses intravenous oxytocin,C0557651|C1707689|C0043210|C0450371|C0205099|G0000000|C1516050|C1514756|C0442027|C0085174|C1442061|C0023128|G0000000|C0439227|C0806909|C0178602|C0348016|C0030095
"Women receiving misoprostol were less likely to have postpartum hemorrhage than those receiving oxytocin (1.9% vs 6.2%, P = .05).",women receiving misoprostol postpartum hemorrhage receiving oxytocin 1 9% 6 2% = 05,C0043210|C1514756|C0085174|C0086839|C0019080|C1514756|C0030095|G0000000|G0000000|G0000000|G0000000|G0000000|C0450371
Similar numbers of women in both groups received epidural anesthesia.,women received epidural anesthesia,C0043210|C1514756|C0228134|C0002903
"More infants born to women in the misoprostol group received intravenous antibiotics in the neonatal period (16.4% vs 6.9%, P = .01), although there were no differences in chorioamnionitis or in proven neonatal infections.",infants born women misoprostol received intravenous antibiotics neonatal period 16 4% 6 9% = 01 differences chorioamnionitis proven neonatal infections,C0021270|C0005615|C0043210|C0085174|C1514756|C0348016|C0003232|C1552240|C0439531|C0450371|G0000000|G0000000|G0000000|G0000000|C0450371|C1705241|C0008495|C0456369|C1552240|C3714514
"We designed this prospective, randomized, double-blinded study to test the hypothesis that the technique used for maintaining hemodynamic stability during general anesthesia can influence recovery after ambulatory surgery.",designed prospective randomized double-blinded study test hypothesis technique maintaining hemodynamic stability anesthesia influence recovery ambulatory surgery,C1707689|C0023981|C0034656|C0205173|C0557651|C0022885|C1512571|C0449851|C0024501|C0019010|C0205360|C0002903|C4054723|C0237820|C0439841|C0038894
"Forty-five healthy consenting women undergoing gynecologic laparoscopy procedures were randomly assigned to 1 of 3 treatment groups: Group 1 (control, n  15) received normal saline 5 mL and 1 mL, followed by a saline infusion at a rate of 0.005 mL  kg 1  min 1 ; Group 2 (n  15) received esmolol 50 mg and saline 1 mL, followed by an esmolol infusion 5 g  kg 1  min 1 ; and Group 3 (n  15) received esmolol 50 mg and nicardipine 1 mg, followed by an esmolol infusion 5 g  kg 1  min 1.",forty-five healthy consenting women undergoing gynecologic laparoscopy procedures randomly assigned 1 3 treatment 1 control 15 received normal saline 5 1 saline infusion rate 0 005 1 min 1 2 15 received esmolol 50 saline 1 esmolol infusion 5 1 min 1 3 15 received esmolol 50 nicardipine 1 esmolol infusion 5 1 min 1,C3816449|C3898900|C1511481|C0043210|G0000000|C0205480|C0031150|C0025664|G0000000|C1516050|G0000000|G0000000|C0039798|G0000000|C0243148|C0450371|C1514756|C0205307|C0036082|G0000000|G0000000|C0036082|C0574032|C0871208|G0000000|C1442061|G0000000|C0702093|G0000000|G0000000|C0450371|C1514756|C0116569|C0450371|C0036082|G0000000|C0116569|C0574032|G0000000|G0000000|C0702093|G0000000|G0000000|C0450371|C1514756|C0116569|C0450371|C0028005|G0000000|C0116569|C0574032|G0000000|G0000000|C0702093|G0000000
"In Group 2, patients received esmolol 50 mg and saline 1 mL IV, and Group 3 received esmolol 50 mg and nicardipine 1 mg IV.",2 patients received esmolol 50 saline 1 iv 3 received esmolol 50 nicardipine 1 iv,G0000000|C0030705|C1514756|C0116569|C0450371|C0036082|G0000000|C0022326|G0000000|C1514756|C0116569|C0450371|C0028005|G0000000|C0022326
"In Group 1 (control), the patients received normal saline 5 mL and 1 mL.",1 control patients received normal saline 5 1,G0000000|C0243148|C0030705|C1514756|C0205307|C0036082|G0000000|G0000000
The study drug doses were doubled after 6 weeks if DBP was greater than or equal to 90 mm Hg.,study drug doses doubled 6 weeks dbp equal 90 mm hg,C0557651|C0013227|C0178602|C0205173|G0000000|C0439230|C0536221|C0205163|C0450371|G0000000|C0025424
"Neurohormone measurements and echocardiography were performed at weeks 0, 12, 24, and 48.",neurohormone measurements echocardiography performed weeks 0 12 24 48,C0597049|C0242485|C0013516|C0884358|C0439230|G0000000|C0450371|C0450371|C0450371
"Thus, 115 hypertensive patients with left ventricular hypertrophy were randomized to receive double-blind irbesartan or atenolol, with additional therapy if needed.",115 hypertensive patients left ventricular hypertrophy randomized receive double-blind irbesartan atenolol additional therapy,C1442061|C0857121|C0030705|C0205091|C0018827|C0020564|C0034656|C1514756|C0013072|C0288171|C0004147|C1524062|C0039798
"If DBP remained greater than or equal to 90 mm Hg at week 12, open label hydrochlorothiazide 12.5 mg once daily (titrated to 25 mg if necessary) was added.",dbp remained equal 90 mm hg week 12 label hydrochlorothiazide 12 5 daily titrated 25,C0536221|G0000000|C0205163|C0450371|G0000000|C0025424|C0332174|C0450371|C0181496|C0020261|C0450371|G0000000|C0332173|C1883350|C0450371
Ten patients in the misoprostol group and 22 patients in the placebo group were delivered by cesarean section.,ten patients misoprostol 22 patients placebo delivered cesarean,C0014518|C0030705|C0085174|C0450371|C0030705|C0032042|C1705822|C3841297
"Methods: In this double-blind randomized trial, 156 pregnant women requiring induction of labor with gestational age of 37-42 weeks and Bishop score F5, were randomized to receive either 200 mg of misoprostol or a placebo, orally.",methods double-blind randomized trial 156 pregnant women requiring induction labor gestational age 37-42 weeks bishop score f5 randomized receive 200 misoprostol placebo orally,C0025663|C0013072|C0034656|C0008976|C1442061|C0549206|C0043210|G0000000|C0205263|C0022864|C0439671|C0001779|C0450371|C0439230|C1551458|C0449820|G0000000|C0034656|C1514756|C1442061|C0085174|C0032042|C0442027
"There was no difference between the groups as regards incidence of maternal side effects, although two patients in the misoprostol group had nausea, three patients in the misoprostol group and two patients in the placebo group vomited after oral medication.",difference incidence maternal effects patients misoprostol nausea patients misoprostol patients placebo vomited oral medication,C1705241|C0021149|C2347083|C1280500|C0030705|C0085174|C0027497|C0030705|C0085174|C0030705|C0032042|C0042963|C0442027|C0013227
"Clinically stable CAD patients with hypertension were randomly assigned to either verapamil SR or atenolol for blood pressure treatment according to the sixth report of the Joint National Committee on Prevention, Detection, Evaluation, and Treatment of High Blood Pressure (JNC VI) (target: systolic blood pressure [SBP] 140 and diastolic blood pressure [DBP] 90 mm Hg or SBP 130 mm Hg and DBP 85 mm Hg when diabetes or renal impairment is present).",clinically stable cad patients hypertension randomly assigned verapamil sr atenolol blood pressure treatment sixth report joint national committee prevention detection evaluation treatment blood pressure jnc vi target systolic blood pressure sbp 140 diastolic blood pressure dbp 90 mm hg sbp 130 mm hg dbp 85 mm hg diabetes renal impairment,G0000000|C0205360|C3813548|C0030705|C0020538|G0000000|C1516050|C0042523|C3813610|C0004147|C0005767|C0033095|C0039798|C0205440|C0684224|C0022417|C3245503|C2699414|C0199176|C1511790|C0220825|C0039798|C0005767|C0033095|G0000000|C0205999|C1521840|C0039155|C0005767|C0033095|G0000000|C1442061|C0012000|C0005767|C0033095|C0536221|C0450371|G0000000|C0025424|G0000000|C1442061|G0000000|C0025424|C0536221|C0450371|G0000000|C0025424|C0011847|C0022646|C0221099
"Results At 24 months, in the CAS group, 6391 patients (81.5%) were taking verapamil sustained release; 4934 (62.9%) were taking trandolapril; and 3430 (43.7%) were taking hydrochlorothiazide.",24 months cas 6391 patients 81 5% verapamil sustained release 4934 62 9% trandolapril 3430 43 7% hydrochlorothiazide,C0450371|C0439231|G0000000|G0000000|C0030705|C0450371|G0000000|C0042523|C0443318|C0030685|G0000000|C0450371|G0000000|C0076891|G0000000|C0450371|G0000000|C0020261
"In the NCAS group, 6083 patients (77.5%) were taking aten-olol; 4733 (60.3%) were taking hydrochlorothiazide; and 4113 (52.4%) were taking trandolapril.",ncas 6083 patients 77 5% aten-olol 4733 60 3% hydrochlorothiazide 4113 52 4% trandolapril,C1413309|G0000000|C0030705|C0450371|G0000000|G0000000|G0000000|C0450371|G0000000|C0020261|G0000000|C0450371|G0000000|C0076891
The first six-week period of 'heart school' in the hospital was followed by nine weeks of organised physical exercise twice weekly at a gymnasium outside the hospital under the supervision of a physiotherapist.,six-week period heart school hospital weeks organised physical exercise weekly gymnasium hospital supervision physiotherapist,C0205452|C0439531|C0018787|C0036375|C0019994|C0439230|C1300196|C0031809|C0015259|C0332174|C0442572|C0019994|C0038842|C2362565
The first phase lasted for six weeks with physical exercise supervised by a specially educated physiotherapist (KP) in addition to regular group meeting twice a week.,phase lasted weeks physical exercise supervised specially educated physiotherapist kp addition regular meeting week,C0205390|C1517741|C0439230|C0031809|C0015259|G0000000|G0000000|C0039401|C2362565|C0022772|C0332287|C0205272|C0556656|C0332174
"Each training session started with 15 minutes of warm-up followed by 20 minutes of dynamic endurance training, 10 minutes of active cool-down activities and, finally, 10 minutes with stretching and relaxation.",training session started 15 minutes warm-up 20 minutes dynamic endurance training 10 minutes active cool-down activities finally 10 minutes stretching relaxation,C0040607|C1883016|C1272689|C0450371|C0439232|C2350169|C0450371|C0439232|C0729333|C0518031|C0040607|C0450371|C0439232|C0205177|C1548792|C0441655|G0000000|C0450371|C0439232|C0600080|C0035028
Two women in the misoprostol group and one in the PGE 2 group had abdominal delivery for failure of cervical ripening with the inducing agents.,women misoprostol pge 2 abdominal delivery failure cervical ripening inducing agents,C0043210|C0085174|C0033559|G0000000|C0000726|C0011209|C0231174|C0027530|C1160534|C0205263|C0450442
"While there were no cases of uterine hyperstimulation in the PGE 2 group, two primiparous women needed salbutamol in the misoprostol group.",uterine hyperstimulation pge 2 primiparous women salbutamol misoprostol,C0042149|G0000000|C0033559|G0000000|C0033150|C0043210|C0001927|C0085174
"Assuming that 40% of women receiving vaginal PGE 2 would deliver within 24 hours of the induction, 6 our sample size was calculated to detect a 25% increase in this number (to 65%) in the misoprostol group (power 90%, a  0.10, h  0.10, Instat Version 3.01, GraphPad Software, San Deigo, California, USA).",assuming 40% women receiving vaginal pge 2 deliver 24 hours induction 6 sample size calculated detect 25% increase 65% misoprostol power 90% 0 10 0 10 instat version 3 01 graphpad software san deigo california usa,G0000000|C0450371|C0043210|C1514756|C0042232|C0033559|G0000000|C0308779|C0450371|C0439227|C0205263|G0000000|C0370003|C0456389|C0444686|C0442726|C0450371|C0442805|C0450371|C0085174|C0032863|C0450371|G0000000|C0450371|G0000000|C0450371|G0000000|C0333052|G0000000|C0450371|G0000000|C0037585|C1826357|G0000000|C0006754|C0041703
Three other women had evidence of tachysystole while on oxytocin augmentation following priming with misoprostol.,women evidence tachysystole oxytocin augmentation priming misoprostol,C0043210|C3887511|C2985339|C0030095|C1293122|C0871133|C0085174
