"In this multicenter, double-blind, parallel-group study, 218 patients with CHF (New York Heart Association class II or III) with impaired left ventricular function (ejection fraction 40%) and pulmonary capillary wedge pressure 13 mm Hg were randomly assigned to 12 weeks of treatment with placebo (n =44) or candesartan cilexetil (2 mg [n = 45], 4 mg [n = 46], 8 mg [n = 39], or 16 mg [n = 44]) once daily after a 2-week placebo run-in period.",multicenter double-blind parallel-group study 218 patients chf york heart association class ii iii impaired left ventricular function ejection fraction 40% pulmonary capillary wedge pressure 13 mm hg randomly assigned 12 weeks treatment placebo =44 candesartan cilexetil 2 = 45 4 = 46 8 = 39 16 = 44 daily 2-week placebo run-in period,C0439743|C0013072|C2348042|C0557651|C1442061|C0030705|C0018802|G0000000|C0018787|C0004083|C0456387|G0000000|C0439070|C0221099|C0205091|C0018827|C0031843|C0302131|C1264633|C0450371|C0024109|C0006901|C0439639|C0033095|C0450371|G0000000|C0025424|G0000000|C1516050|C0450371|C0439230|C0039798|C0032042|C0450371|C0717550|G0000000|G0000000|G0000000|C0450371|G0000000|G0000000|C0450371|G0000000|G0000000|C0450371|C0450371|G0000000|C0450371|C0332173|C0332174|C0032042|C3274438|C0439531
Three thousand ten patients with operable node-positive breast cancer were randomly assigned to receive adjuvant anthracycline-based chemotherapy with or without docetaxel.,ten patients operable node-positive breast cancer randomly assigned receive adjuvant anthracycline-based chemotherapy docetaxel,C0014518|C0030705|C0205188|C0746319|C0006141|C0006826|G0000000|C1516050|C1514756|C0001551|C0003234|C0013216|C0246415
"Each patient received an infusion of either IVIG or placebo (4% dextrose, 0.18% normal saline) at a dose of 1 g/kg on days 0 and 1 (maximum, 60 g) and then 0.4 mg/kg on days 14 and 28.",patient received infusion ivig placebo 4% dextrose 018% normal saline dose 1 g/kg days 0 1 maximum 60 04 mg/kg days 14 28,C0030705|C1514756|C0574032|C0085297|C0032042|G0000000|C0017725|C1442061|C0205307|C0036082|C0178602|G0000000|C1300563|C0439228|G0000000|G0000000|C0806909|C0450371|C0450371|C0439272|C0439228|C0450371|C0450371
"For patients whose study medications were discontinued either permanently or temporarily, 81 (26.8%) discontinued clopidogrel or aspirin patients received nonstudy warfarin, 94 (55.6%) discontinued warfarin patients received nonstudy aspirin, and 72 (48.0%) discontinued clopidogrel patients received nonstudy aspirin.",patients study medications discontinued permanently temporarily 81 268% discontinued clopidogrel aspirin patients received nonstudy warfarin 94 556% discontinued warfarin patients received nonstudy aspirin 72 480% discontinued clopidogrel patients received nonstudy aspirin,C0030705|C0557651|C0013227|C1444662|G0000000|G0000000|C0450371|C1442061|C1444662|C0070166|C0004057|C0030705|C1514756|G0000000|C0043031|C0450371|C1442061|C1444662|C0043031|C0030705|C1514756|G0000000|C0004057|C0450371|C1442061|C1444662|C0070166|C0030705|C1514756|G0000000|C0004057
"Regarding cardiac toxicity, trastuzumab treatment was stopped if LVEF dropped below 45%, or if LVEF was between 45% and 50% together with a relative decrease of 15% or more.",cardiac toxicity trastuzumab treatment stopped lvef dropped 45% lvef 45% 50% relative decrease 15%,C0018787|C0040539|C0728747|C0039798|C1272691|C0428772|C1705648|C0450371|C0428772|C0450371|C0450371|C0080103|C0392756|C0450371
"A limitation of this study could be that the licensed doses of doxorubicin and epirubin differ; therefore, different (prospectively dened) doses of dexrazoxane had to be administered according to the anthracycline treatment regimen (20:1 dexrazoxane: doxorubicin or 10:1 dexrazoxane:epirubicin dose ratio).",limitation study licensed doses doxorubicin epirubin prospectively dened doses dexrazoxane administered anthracycline treatment regimen 201 dexrazoxane doxorubicin 101 dexrazoxaneepirubicin dose ratio,C0449295|C0557651|C0023636|C0178602|C0013089|G0000000|G0000000|G0000000|C0178602|C0086444|C1521801|C0003234|C0039798|C0040808|C1442061|C0086444|C0013089|C1442061|G0000000|C0178602|C0456603
"Of the 1587 patients randomized, 523 received aspirin, 524 received clopidogrel, and 540 received warfarin.",1587 patients randomized 523 received aspirin 524 received clopidogrel 540 received warfarin,G0000000|C0030705|C0034656|C1442061|C1514756|C0004057|C1442061|C1514756|C0070166|C1442061|C1514756|C0043031
"In a randomized manner, telephone dispatchers gave bystanders at the scene of apparent cardiac arrest instructions in either chest compression alone or chest compression plus mouthto-mouth ventilation.",randomized manner telephone dispatchers bystanders scene apparent cardiac arrest instructions chest compression chest compression mouthto-mouth ventilation,C0034656|G0000000|C0039457|G0000000|G0000000|G0000000|C0750489|C0018787|C0237477|C0302828|C0817096|C0332459|C0817096|C0332459|C0226896|C0035203
The control group received an information session provided by the cardiac rehabilitation coordinator and then follow-up care by either their cardiologist or general practitioner.,control received session provided cardiac rehabilitation coordinator follow-up care cardiologist practitioner,C0243148|C1514756|C1883016|C1999230|C0018787|C0034991|C1711307|C0589120|C1947933|C0175906|C1709627
"The patients were randomly assigned in two groups (N = 10) to receive or not dexrazoxane hydrochloride (Cardioxane, Chiron, Amsterdam, The Netherlands), given intravenously (400 mg/m2) over 15 min, immediately after the cyclophosphamideepirubicin infusion.",patients randomly assigned = 10 receive dexrazoxane hydrochloride cardioxane chiron amsterdam netherlands intravenously 400 mg/m2 15 min cyclophosphamideepirubicin infusion,C0030705|G0000000|C1516050|G0000000|C0450371|C1514756|C0086444|C1512523|C0524711|C1504071|G0000000|C0027778|G0000000|C1442061|C0026410|C0450371|C0702093|G0000000|C0574032
"Either the reversed vein or a stretched thin-walled 6-mm polytetrauoroethylene (W. L. Gore, Flagstaff, Ariz) prosthesis was used.",reversed vein stretched thin-walled 6-mm polytetrauoroethylene gore flagstaff ariz prosthesis,C1555029|C0042449|C1883175|C0205168|G0000000|G0000000|G0000000|G0000000|G0000000|C0175649
A randomized cross-over design was used to determine the effect of a longer KC condition (30 minutes of KC before and throughout heel stick; KC30) and a shorter KC condition (15 minutes of KC before and throughout heel stick; KC15) compared with standard incubator care (IC) during heel stick.,randomized cross-over design determine kc condition 30 minutes kc heel stick kc30 shorter kc condition 15 minutes kc heel stick kc15 compared standard incubator care ic heel stick,C0034656|C0010366|C1707689|G0000000|C0022575|C0012634|C0450371|C0439232|C0022575|C0018870|C1706582|G0000000|C1282927|C0022575|C0012634|C0450371|C0439232|C0022575|C0018870|C1706582|G0000000|C1707455|C1442989|C0021178|C1947933|C0020750|C0018870|C1706582
"The grafts applied were either a 6-mm externally supported thin wall uoropolymer coated knitted polyester (P-EXS) or a 6-mm externally unsupported thin wall knitted polyester (P-non-EXS) (both Fluoropassiv, Sulzer Vascutek, Inchinnan Renfrewshire, Scotland, United Kingdom).",grafts applied 6-mm externally supported thin wall uoropolymer coated knitted polyester p-exs 6-mm externally unsupported thin wall knitted polyester p-non-exs fluoropassiv sulzer vascutek inchinnan renfrewshire scotland united kingdom,C0332835|C4048755|G0000000|C0205101|C1521721|C0205168|C0677535|G0000000|C1522408|C0868977|C0032474|C0369773|G0000000|C0205101|G0000000|C0205168|C0677535|C0868977|C0032474|C0369773|G0000000|G0000000|G0000000|G0000000|G0000000|C0036453|C0166872|C1708611
"20 patients were scheduled to receive 3 g L-carnitine before each chemotherapy cycle, followed by 1 g L-carnitine/day during the following 21 days, while 20 patients received a placebo (randomized controlled trial).",20 patients scheduled receive 3 l-carnitine chemotherapy cycle 1 l-carnitine/day 21 days 20 patients received placebo randomized controlled trial,C0450371|C0030705|C0086960|C1514756|G0000000|C0087163|C0013216|C1511572|G0000000|C0475219|C0450371|C0439228|C0450371|C0030705|C1514756|C0032042|C0034656|C2587213|C0008976
"After the 12-week intervention or control condition, T2 measures were taken at the physical function laboratory, and intervention participants received telephone calls weekly, then bimonthly, and at the end of 3 months to monitor walking progress and or depressive symptoms.",12-week intervention control condition t2 measures physical function laboratory intervention participants received telephone calls weekly bimonthly 3 months monitor walking progress depressive symptoms,C0450371|C0886296|C0243148|C0012634|C0041403|C0079809|C0031809|C0031843|C0022877|C0886296|C0679646|C1514756|C0039457|C0679006|C0332174|C0585337|G0000000|C0439231|C0030695|C0080331|C1272688|G0000000|C0683368
"After 12 weeks, the telephonic feedback was terminated and the patients were advised to continue their training with the heart rate monitor.",12 weeks telephonic feedback terminated patients advised continue training heart rate monitor,C0450371|C0439230|C0039457|C0015744|C1553404|C0030705|G0000000|C0549178|C0040607|C0018787|C0871208|C0030695
"To determine whether dexrazoxane decreases doxorubicin-associated injury of cardiomyocytes, we randomly assigned 101 children with ALL to receive doxorubicin alone (30 mg per square meter of body-surface area every three weeks for 10 doses) and 105 to receive dexrazoxane (300 mg per square meter) followed immediately by doxorubicin.",determine dexrazoxane decreases doxorubicin-associated injury cardiomyocytes randomly assigned 101 children receive doxorubicin 30 square meter body-surface weeks 10 doses 105 receive dexrazoxane 300 square meter doxorubicin,G0000000|C0086444|C0442797|C0013089|C3263722|C0225828|G0000000|C1516050|C1442061|C0008059|C1514756|C0013089|C0450371|C0205120|C0475209|C0489451|C0439230|C0450371|C0178602|C1442061|C1514756|C0086444|C1442061|C0205120|C0475209|C0013089
"In contrast, SSC neonates were placed prone and skin  to skin on their mothers chest in her bed for the rest period.",contrast ssc neonates prone skin skin mothers chest bed rest period,C0009924|C3897657|C0021289|C0033422|C0444099|C0444099|C0026591|C0817096|C0004916|C0035253|C0439531
The 30 patients in group 2 had a reversed L-shaped  ministernotomy from the sternal notch to the 3rd intercostal  space.,30 patients 2 reversed l-shaped ministernotomy sternal notch 3rd intercostal space,C0450371|C0030705|G0000000|C1555029|C0022828|G0000000|C0038293|C1235660|G0000000|G0000000|C1883067
"Patients in the intervention group received an individualized, multidisciplinary 12-week cardiac rehabilitation program, including an individualized exercise component tailored to functional ability and social circumstances.",patients intervention received individualized multidisciplinary 12-week cardiac rehabilitation program including individualized exercise component tailored functional ability social circumstances,C0030705|C0886296|C1514756|C1881197|C0242479|C0450371|C0018787|C0034991|C1709697|C0332257|C1881197|C0015259|C0449432|C0402883|C0205245|C0085732|C0728831|G0000000
"Results: Median dose intensity of epirubicin and paclitaxel was double in group A, as designed, with signicantly less cycles administered at full dose (P < 0.001).",median dose intensity epirubicin paclitaxel double designed signicantly cycles administered dose < 0001,C0549183|C0178602|C0522510|C0014582|C0144576|C0205173|C1707689|G0000000|C1511572|C1521801|C0178602|G0000000|G0000000
"A larger study, the Warfarin Anti-platelet Trial in Chronic Heart Failure (WATCH), comparing warfarin (target INR 3.0), aspirin (160 mg/day), and clopidogrel (75 mg/day), will report soon.23 Clopidogrel exerts its antithrombotic effects through platelet ADP receptors and has no direct effect on prostaglandin synthesis.24 Comparison of aspirin and clopidogrel in this patient population should allow any benet from reducing platelet aggregation to be separated from potential adverse effects of aspirin on vascular wall prostaglandin synthesis.",larger study warfarin anti-platelet trial chronic heart failure watch comparing warfarin target inr 30 aspirin 160 mg/day clopidogrel 75 mg/day report soon23 clopidogrel exerts antithrombotic effects platelet adp receptors direct prostaglandin synthesis24 comparison aspirin clopidogrel patient population benet reducing platelet aggregation separated potential adverse effects aspirin vascular wall prostaglandin synthesis,C0549177|C0557651|C0043031|C0005821|C0008976|C0205191|C0018787|C0231174|C0699864|C1707455|C0043031|C1521840|C0525032|C0450371|C0004057|C1442061|C0439422|C0070166|C0450371|C0439422|C0684224|G0000000|C0070166|C0015264|G0000000|C1280500|C0005821|C0523452|C0597357|C0439851|C0033554|G0000000|C1707455|C0004057|C0070166|C0030705|C0032659|G0000000|C0392756|C0005821|C0332621|C0086972|C3245505|G0000000|C1280500|C0004057|C0005847|C0677535|C0033554|C0220781
"Oral coumarin (Sintrom, Ciba-Geigy) was started the day before the operation and was continued for 6 months, with aim for an international normalized ratio between 2 and 4.",oral coumarin sintrom ciba-geigy started day operation continued 6 months aim international normalized ratio 2 4,C0442027|C0010206|C0919378|C0331935|C1272689|C0332173|C0543467|C0549178|G0000000|C0439231|C1947946|C1512888|C1882115|C0456603|G0000000|G0000000
"Patients were randomly assigned to receive either eprosartan (400 mg daily, given as 200 mg twice daily) or matching placebo.",patients randomly assigned receive eprosartan 400 daily 200 daily matching placebo,C0030705|G0000000|C1516050|C1514756|C0287041|C1442061|C0332173|C1442061|C0332173|C0150103|C0032042
All patients were treated with warfarin.,patients treated warfarin,C0030705|C1522326|C0043031
"Patients,  stratified  for  blocker  use,  were randomly  assigned  losartan  (n=1578) titrated to 50 mg once daily or captopril (n=1574) titrated to  50  mg  three  times  daily.",patients stratified blocker randomly assigned losartan n=1578 titrated 50 daily captopril n=1574 titrated 50 times daily,C0030705|C0205363|G0000000|G0000000|C1516050|C0126174|C0369718|C1883350|C0450371|C0332173|C0006938|C0369718|C1883350|C0450371|C0040223|C0332173
"In general, the program recommended a comprehensive approach to managing the heart condition, that is, using medicines as prescribed, following dietary recommendations, and obtaining adequate exercise.",program recommended comprehensive approach managing heart condition medicines prescribed dietary recommendations obtaining adequate exercise,C1709697|C0034866|C1880156|C0449445|C1273870|C0018787|C0012634|C0013227|C0278329|C0012155|C0034866|C1301820|C0205410|C0015259
"Between January 1999 and July 2001, 80 consecutive patients undergoing elective aortic valve replacement were randomly divided into two groups: group I (n  40 patients) undergoing a ministernotomy approach (reversed-C or reversed-L), and group II (n  40 patients) undergoing conventional sternotomy.",january 1999 july 2001 80 consecutive patients undergoing elective aortic valve replacement randomly divided 40 patients undergoing ministernotomy approach reversed-c reversed-l ii 40 patients undergoing conventional sternotomy,C3829466|G0000000|C3829447|G0000000|C0450371|C1707491|C0030705|G0000000|C0206058|C0003483|C0184252|C0035139|G0000000|C0332849|C0450371|C0030705|G0000000|G0000000|C0449445|C1555029|C1555029|G0000000|C0450371|C0030705|G0000000|C0439858|C0185792
"Accordingly, infants  randomized to the MR group received 0.5, 0.75, and 1 g/kg/min and  those infants randomized to the LEVO group received 0.1, 0.15, and 0.2  g/kg/min, for doses 1, 2, and 3, respectively.",infants randomized received 05 075 1 g/kg/min infants randomized levo received 01 015 02 g/kg/min doses 1 2 3,C0021270|C0034656|C1514756|C0450371|C1442061|G0000000|C1320758|C0021270|C0034656|C0205091|C1514756|C0450371|C1442061|C0450371|C1320758|C0178602|G0000000|G0000000|G0000000
"The RadIal Vs femorAL access for coronary intervention  (RIVAL)  trial was a randomised, parallel group,  multicentre trial.",radial femoral access coronary intervention rival trial randomised parallel multicentre trial,C0442038|C0015811|C0444454|C0018787|C0886296|G0000000|C0008976|G0000000|C2348042|C0439743|C0008976
Methods: We performed a prospective and randomized study in which 408 patients underwent coronary angiography (CAG) and/or percutaneous coronary intervention (PCI) via transradial approach (TRA) and 428 patients underwent CAG and/or PCI via transfemoral approach (TFA).,methods performed prospective randomized study 408 patients underwent coronary angiography cag and/or percutaneous coronary intervention pci transradial approach tra 428 patients underwent cag and/or pci transfemoral approach tfa,C0025663|C0884358|C0023981|C0034656|C0557651|C1442061|C0030705|G0000000|C0018787|C0002978|G0000000|G0000000|C0522523|C0018787|C0886296|C4049621|G0000000|C0449445|C0040845|C1442061|C0030705|G0000000|G0000000|G0000000|C4049621|G0000000|C0449445|C0040982
Above-knee (AK) femoro-popliteal bypass grafting is an effective treatment for either disabling claudication or critical ischaemia.,above-knee ak femoro-popliteal bypass grafting effective treatment disabling claudication critical ischaemia,C1282910|C0001905|C0545765|C0741847|C0332835|C1280519|C0039798|G0000000|C0311395|C1511545|C0022116
"The median chemotherapy duration in our study was 18 weeks, the same in both arms, and the median cumulative dose of all drugs was virtually identical, while, by design, the median DIs of epirubicin and paclitaxel were double in the dose-dense arm.",median chemotherapy duration study 18 weeks arms median cumulative dose drugs virtually identical design median dis epirubicin paclitaxel double dose-dense arm,C0549183|C0013216|C0449238|C0557651|C0450371|C0439230|C0206655|C0549183|C1511559|C0178602|C0013227|G0000000|C0205280|C1707689|C0549183|C0451119|C0014582|C0144576|C0205173|C0178602|C0446516
"Fire-department dispatchers followed a structured interrogation protocol with two basic questions: Is the patient conscious or awake? and Is the patient breathing normally? If the answers to both of these questions were no or equivocal, an emergency-medical-services team was immediately dispatched and the caller was assured that help was on the way; in addition, if there was no one on the scene who was already performing (or intending to perform) CPR , and if the caller was willing to be instructed, the caller was given instructions for performing either chest compression alone or chest compression plus mouth-to-mouth ventilation (Fig. 1), as randomly assigned by a microcomputer located at the dispatchers console.",fire-department dispatchers structured interrogation protocol basic questions patient conscious awake patient breathing answers questions equivocal emergency-medical-services team dispatched caller assured addition scene performing intending perform cpr caller instructed caller instructions performing chest compression chest compression mouth-to-mouth ventilation fig 1 randomly assigned microcomputer located dispatchers console,C0016141|G0000000|C0678594|C0680701|C0442711|C1527178|C1522634|C0030705|C0234421|C0234422|C0030705|C0004048|C1706817|C1522634|C0332241|C0013961|C0871489|G0000000|G0000000|G0000000|C0332287|G0000000|C0884358|G0000000|C0884358|C0007203|G0000000|G0000000|G0000000|C0302828|C0884358|C0817096|C0332459|C0817096|C0332459|C0226896|C0035203|C0349966|G0000000|G0000000|C1516050|C0025971|G0000000|G0000000|C3873699
"69 patients with ST elevation Acute Myocardial Infarction (AMI), <12 hours after symptoms onset, undergoing primary angioplasty, with documented multivessel disease and both culprit lesion and 1 to 3 other lesions suitable for implantation.",69 patients st elevation acute myocardial infarction ami <12 hours symptoms onset undergoing primary angioplasty documented multivessel disease culprit lesion 1 3 lesions suitable implantation,C0450371|C0030705|C0036056|C0439775|C0205178|C0027061|C0021308|G0000000|C0450371|C0439227|C0683368|C0206132|G0000000|C0205225|C0162577|C1301725|G0000000|C0012634|G0000000|C0221198|G0000000|G0000000|C0221198|C3900053|C0021107
"The intervention was standardized with a flip chart so that patients and family members received the same information components, but it was tailored to the patients own past medical experience and unique living situation.",intervention standardized flip chart patients family received components tailored patients medical experience unique living situation,C0886296|G0000000|C1413357|C0007963|C0030705|C0015576|C1514756|C0449432|C0402883|C0030705|C0199168|C0237607|C1710548|C0376558|G0000000
The intervention group also received the study intervention that started before they underwent the PCI procedure and lasted until the sixteenth week after hospital discharge.,intervention received study intervention started underwent pci procedure lasted sixteenth week hospital discharge,C0886296|C1514756|C0557651|C0886296|C1272689|G0000000|C4049621|C0184661|C1517741|G0000000|C0332174|C0019994|C0012621
314 patients were randomly allocated complete revascularisation and 313 individuals were assigned no further invasive treatment.,314 patients randomly allocated complete revascularisation 313 individuals assigned invasive treatment,C1442061|C0030705|G0000000|G0000000|C0205197|C0581603|C1442061|C0027361|C1516050|C0205281|C0039798
"Results were used to develop individualized exercise prescriptions on the basis of established guidelines, and participants were encouraged to accumulate at least 150 minutes of exercise per week at their target heart rate, preferably exercising most days of the week via stationary bicycle/treadmill/walking.",develop individualized exercise prescriptions basis established guidelines participants encouraged accumulate 150 minutes exercise week target heart rate preferably exercising days week stationary bicycle/treadmill/walking,G0000000|C1881197|C0015259|C0033080|C1527178|C0443211|C0162791|C0679646|G0000000|G0000000|C1442061|C0439232|C0015259|C0332174|C1521840|C0018787|C0871208|G0000000|C0015259|C0439228|C0332174|C0439835|C0005375
"They were provided the same education materials as patients attending the supervised models at their initial visit, which was reviewed on the phone with program staff.",provided education materials patients attending supervised models initial visit reviewed phone program staff,C1999230|C0013621|C0520510|C0030705|C1547429|G0000000|C3161035|C0205265|C0545082|C0282443|C1515258|C1709697|C0851286
"All patients had to be in a stable condition on a diuretic plus the ACE inhibitor enalapril 10 mg twice daily for 28 days before randomisation, with or without digoxin.",patients stable condition diuretic ace inhibitor enalapril 10 daily 28 days randomisation digoxin,C0030705|C0205360|C0012634|C0012798|C1452534|C1999216|C0014025|C0450371|C0332173|C0450371|C0439228|C0034656|C0012265
"Calibration measurements using an Alderson-Phantom at a height of 130 cm during uoroscopy revealed that the Stephens 6000 dosimeter underestimated the ambient dose equivalent at depth of 1 cm, i.e., H  (10), by a factor of 7.4.",calibration measurements alderson-phantom height 130 cm uoroscopy revealed stephens 6000 dosimeter underestimated ambient dose equivalent depth 1 cm 10 factor 74,C0006751|C0242485|C0282611|C0489786|C1442061|G0000000|G0000000|C0443289|G0000000|G0000000|C0180488|G0000000|C1879688|C0178602|C0205163|C0205125|G0000000|G0000000|C0450371|C1521761|C0450371
"In the ablation group, patients underwent cavo-tricuspid and left inferior pulmonary vein (PV)-mitral isthmus ablation plus circumferential PV ablation.",ablation patients underwent cavo-tricuspid left inferior pulmonary vein pv-mitral isthmus ablation circumferential pv ablation,C0547070|C0030705|G0000000|C0443327|C0205091|C0542339|C0024109|C0042449|C0032463|C2985476|C0547070|C0205113|C0032463|C0547070
"In the other 30 patients, a full sternotomy was carried out, with cannulation for CPB, and antegrade cold blood cardioplegia for myocardial protection.",30 patients sternotomy carried cannulation cpb antegrade cold blood cardioplegia myocardial protection,C0450371|C0030705|C0185792|C0206243|C0917707|G0000000|C0589502|C0009264|C0005767|C0018791|C0027061|C1545588
"After 6 weeks for optimization of the aerobic portion of the protocol, a resistive training component was added that involved both upper and lower extremity strengthening.",6 weeks optimization aerobic portion protocol resistive training component involved upper lower extremity strengthening,G0000000|C0439230|C2698650|C1510824|C0449719|C0442711|G0000000|C0040607|C0449432|C1314939|C1282910|C0441994|C0015385|G0000000
"Eighty low-to moderate-risk cardiac patients were randomized to a TP (n=42) or a MP (n=38) and were compared over 6 months on program participation, exercise adherence, cardiovascular outcomes, and program costs.",low-to moderate-risk cardiac patients randomized tp n=42 mp n=38 compared 6 months program participation exercise adherence cardiovascular outcomes program costs,C0205251|C0205081|C0018787|C0030705|C0034656|C0036183|C0369718|C0024944|C0369718|C1707455|G0000000|C0439231|C1709697|C0679823|C0015259|C1510802|C0007226|C1274040|C1709697|C0010186
"There were four deaths in the placebo group and 2 and 0 deaths in the enoximone 25 mg three times a day and enoximone 50 mg three times a day groups, respectively.",deaths placebo 2 0 deaths enoximone 25 times day enoximone 50 times day,C0011065|C0032042|G0000000|G0000000|C0011065|C0116190|C0450371|C0040223|C0332173|C0116190|C0450371|C0040223|C0332173
Group B received KC on the rst day and routine IC on the second day.,received kc rst day routine ic day,C1514756|C0022575|C1425219|C0332173|C0205547|C0020750|C0332173
