"Power analysis calculated using Stata 7.0 software (Stata Corp LP, Bryan/College Station, TX, USA) to show a 50% reduction in the incidence of neonatal acidemia indicated a sample size of 761 per arm (a = 0.05, b = 0.20).",power analysis calculated stata 7 0 software stata corp lp bryan/college station tx usa 50% reduction incidence neonatal acidemia sample size 761 arm = 0 05 = 0 20,C0032863|C0002778|C0444686|G0000000|G0000000|G0000000|C0037585|G0000000|C0683758|C0037943|C0557806|C1883167|C0041403|C0041703|C0450371|C0301630|C0021149|C1552240|C0001122|C0370003|C0456389|C1442061|C0446516|G0000000|G0000000|C0450371|G0000000|G0000000|C0450371
"Seventy-two patients were randomized to return to full normal activities, including work at 2 weeks, after AMI without a formal rehabilitation program (early return to normal activities [ERNA] group).",seventy-two patients randomized return normal activities including 2 weeks ami formal rehabilitation program return normal activities erna,C3816957|C0030705|C0034656|C0332156|C0205307|C0441655|C0332257|G0000000|C0439230|G0000000|C0348078|C0034991|C1709697|C0332156|C0205307|C0441655|G0000000
This group of patients was contacted over the telephone by the nurse coordinator once per week for 5 weeks.,patients contacted telephone nurse coordinator week 5 weeks,C0030705|C0332158|C0039457|C0028661|C1711307|C0332174|G0000000|C0439230
"Seventy patients were randomized to undergo the standard cardiac rehabilitation program and return to full normal activities, including work at 6 weeks after AMI (conventional treatment group).",seventy patients randomized undergo standard cardiac rehabilitation program return normal activities including 6 weeks ami conventional treatment,C3816957|C0030705|C0034656|G0000000|C1442989|C0018787|C0034991|C1709697|C0332156|C0205307|C0441655|C0332257|G0000000|C0439230|G0000000|C0439858|C0039798
The 2 groups of patients were encouraged to exercise at home on a regular basis.,2 patients encouraged exercise regular basis,G0000000|C0030705|G0000000|C0015259|C0205272|C1527178
"Fatigue in patients receiving high-dose (400 mg) ER metoprolol succinate in combination with medium-to high-dose (10 and 20 mg) ER felodipine was relatively common (20% for 10/400 mg and 18% for 20/400 mg, and 2% to 9% for the other treatment groups).",fatigue patients receiving high-dose 400 er metoprolol succinate combination medium-to high-dose 10 20 er felodipine common 20% 10/400 18% 20/400 2% 9% treatment,C0015672|C0030705|C1514756|C0444956|C1442061|C3810541|C0025859|C0038617|C0205195|C0009458|C0444956|C0450371|C0450371|C3810541|C0015772|C0205214|C0450371|C0450371|C0450371|C0450371|G0000000|G0000000|C0039798
"After the placebo run-in, patients meeting BP criteria were randomized to one of the 16 treatment groups.",placebo run-in patients meeting bp criteria randomized 16 treatment,C0032042|C3274438|C0030705|C0556656|C0037623|C0243161|C0034656|C0450371|C0039798
Patients assigned to ER felodipine 20 mg and/or ER metoprolol succinate 400 mg received half doses for 1 week before escalation to the full dose.,patients assigned er felodipine 20 and/or er metoprolol succinate 400 received half doses 1 week escalation dose,C0030705|C1516050|C3810541|C0015772|C0450371|G0000000|C3810541|C0025859|C0038617|C1442061|C1514756|C2825407|C0178602|G0000000|C0332174|G0000000|C0178602
"To maintain blinding, patients received 6 active or placebo tablets or both each morning, packaged according to a double-dummy dosing scheme.",maintain blinding patients received 6 active placebo tablets morning packaged double-dummy dosing scheme,C0024501|C0150108|C0030705|C1514756|G0000000|C0205177|C0032042|C0039225|C0332170|C0030176|C0205173|G0000000|C1519193
All patients received instruction and counseling to promote compliance with the Japan Atherosclerosis Society Guidelines for Diagnosis and Treatment of Atherosclerotic Cardiovascular Diseases Step I diet.,patients received instruction counseling promote compliance japan atherosclerosis society guidelines diagnosis treatment atherosclerotic cardiovascular diseases step diet,C0030705|C1514756|C0039401|C0010210|C0033414|C0009563|C0022341|C0003850|C0037455|C0162791|C0011900|C0039798|C0333482|C0007226|C0012634|C1261552|C0012155
All patients were observed for 6 months.,patients observed 6 months,C0030705|C1441672|G0000000|C0439231
"Apart from endovascular intervention, the patients of both groups received heparin, aspirin, plavix, statins, angiotensin-converting enzyme inhibitors, and -adrenoceptor blockers in individual doses.",endovascular intervention patients received heparin aspirin plavix statins angiotensin-converting enzyme inhibitors -adrenoceptor blockers individual doses,C0524425|C0886296|C0030705|C1514756|C0019134|C0004057|C0633084|C0360714|C0003018|C0014442|C0243077|C0034783|G0000000|C0027361|C0178602
"MATERIALS AND METHODS Open randomized parallel controlled study included 44 patients (22 patients in the main and control groups, groups 1 and 2, respectively, Fig, 1).",materials methods randomized parallel controlled study included 44 patients 22 patients main control 1 2 fig 1,C0520510|C0025663|C0034656|C2348042|C2587213|C0557651|C0332257|C0450371|C0030705|C0450371|C0030705|C0205225|C0243148|G0000000|G0000000|C0349966|G0000000
"The incidence and severity of chronic heart failure, heart rhythm disturbances, exercise tolerance, and quality of life were similar in both groups (Table 1).",incidence severity chronic heart failure heart rhythm disturbances exercise tolerance quality life table 1,C0021149|C0439793|C0205191|C0018787|C0231174|C0018787|C0871269|C2699787|C0015259|C0013220|C0332306|C0376558|C0039224|G0000000
BMMC were isolated by gradient centrifugation (HISTOPAQUE-1077 density gradient) [9].,bmmc isolated gradient centrifugation histopaque-1077 density gradient 9,G0000000|C0205409|C0439182|C0007703|C0164836|C0178587|C0439182|G0000000
Bone marrow was harvested one day after successful PCI for ST elevation myocardial infarction.,bone marrow harvested day successful pci st elevation myocardial infarction,C0262950|C0086590|C1512335|C0332173|C0597535|C4049621|C0036056|C0439775|C0027061|C0021308
"Methods: 20 patients admitted within 24 h after the onset of a first AMI were randomly allocated to receive intracoronary autologous BMT (n = 10) or bone marrow supernatant (controls, n = 10) immediately after primary percutaneous coronary intervention.",methods 20 patients admitted 24 onset ami randomly allocated receive intracoronary autologous bmt = 10 bone marrow supernatant controls = 10 primary percutaneous coronary intervention,C0025663|C0450371|C0030705|C0184666|C0450371|C0206132|G0000000|G0000000|G0000000|C1514756|C0595454|C0439859|C0005961|G0000000|C0450371|C0262950|C0086590|C1550101|C0243148|G0000000|C0450371|C0205225|C0522523|C0018787|C0886296
Methods: Ninety nor-motensive patients (ASA I) undergoing elective surgery were divided into three groups of 30 patients each.,methods nor-motensive patients asa undergoing elective surgery divided 30 patients,C0025663|G0000000|C0030705|C0004057|G0000000|C0206058|C0038894|C0332849|C0450371|C0030705
"Ephedrine (3 mg increments) was administered for hypotension (systolic arterial pressure (SAP)  100 mmHg, or a decrease of 30% from baseline values for 60 s) and atropine, in 300 g increments, for bradycardia (HR  45 beats min",ephedrine 3 increments administered hypotension systolic arterial pressure sap 100 mmhg decrease 30% baseline values 60 atropine 300 increments bradycardia hr 45 beats min,C0014479|G0000000|C1705117|C1521801|C0020649|C0039155|C0003842|C0033095|C1420017|C1442061|C0439475|C0392756|C0450371|C0168634|C0042295|C0450371|C0004259|C1442061|C1705117|C0428977|G0000000|C0450371|G0000000|C0702093
"Patients received oral placebo (Group I), 400 mg of gabapentin (Group II) or 800 mg of gabapentin (Group III) 1 h prior to surgery in the operating theatre.",patients received oral placebo 400 gabapentin ii 800 gabapentin iii 1 prior surgery operating theatre,C0030705|C1514756|C0442027|C0032042|C1442061|C0060926|G0000000|C1442061|C0060926|C0439070|G0000000|C0332152|C0038894|C3242339|C0475307
One patient in Group I and one patient in Group II received an increased inspired concentration of sevoflurane to treat hypertension.,patient patient ii received increased inspired concentration sevoflurane treat hypertension,C0030705|C0030705|G0000000|C1514756|C0205217|C0004048|C0004268|C0074414|C0087111|C0020538
"Patients received weekly paclitaxel single agent (80 mg/m 2) or combined with trastuzumab (4 mg/kg loading dose, then weekly 2 mg/kg).",patients received weekly paclitaxel single agent 80 mg/m 2 combined trastuzumab 4 mg/kg loading dose weekly 2 mg/kg,C0030705|C1514756|C0332174|C0144576|C0037179|C0450442|C0450371|C0026410|G0000000|C0205195|C0728747|G0000000|C0439272|C1708715|C0178602|C0332174|G0000000|C0439272
"Eligible patients were women with untreated metastatic BC over-expressing HER-2/neu by the HercepTrastuzumab was administered at the loading dose of 4 mg/kg on day 1, as 90-min infusion followed by weekly doses of 2 mg/kg given over 30 min.",eligible patients women untreated metastatic bc over-expressing her-2/neu herceptrastuzumab administered loading dose 4 mg/kg day 1 90-min infusion weekly doses 2 mg/kg 30 min,C1548635|C0030705|C0043210|C0332155|C0036525|C0006041|C0205136|C1702024|G0000000|C1521801|C1708715|C0178602|G0000000|C0439272|C0332173|G0000000|C0450371|C0574032|C0332174|C0178602|G0000000|C0439272|C0450371|C0702093
The ECOG performance status was 0-1 in 95 A) and 36 cases (57.1%) (arm B) treated with anthracyclines-based regimens (Table 1).,ecog performance status 0-1 95 36 57 1% arm treated anthracyclines-based regimens table 1,C0430797|C0597198|C0449438|G0000000|C0450371|C0450371|C0450371|G0000000|C0446516|C1522326|C0003234|C2945654|C0039224|G0000000
"The patients were allocated by the independent monitoring agency to treatment group by randomization code envelopes, with a 1:1 randomization (paclitaxel, arm A vs. paclitaxel plus trastuzumab, arm B), stratified according to visceral involvement (yes vs. not), HER-2/neu over-expression (2+ vs. 3+) and center.",patients allocated independent monitoring agency treatment randomization code envelopes 1 1 randomization paclitaxel arm paclitaxel trastuzumab arm stratified visceral involvement her-2/neu over-expression 2+ 3+ center,C0030705|G0000000|C0085862|C0150369|C0237463|C0039798|C0034656|C0009219|C1622204|G0000000|G0000000|C0034656|C0144576|C0446516|C0144576|C0728747|C0446516|C0205363|C0442045|C1314939|C1702024|C0205136|G0000000|G0000000|C0205099
The rate of vaginal delivery within 24 h of induction was similar in both groups: 75% with oral misoprostol 25 g every 3 h and 72% with misoprostol (two doses) plus routine oxytocin.,rate vaginal delivery 24 induction 75% oral misoprostol 25 3 72% misoprostol doses routine oxytocin,C0871208|C0042232|C0011209|C0450371|C0205263|C0450371|C0442027|C0085174|C0450371|G0000000|C0450371|C0085174|C0178602|C0205547|C0030095
"Methods: A prospective randomised trial in which 200 women with an unfavourable cervix received either oral misoprostol 25 g every 3 h (group 1, n = 100) or two such doses routinely followed by oxytocin (group 2, n = 100).",methods prospective randomised trial 200 women unfavourable cervix received oral misoprostol 25 3 1 = 100 doses routinely oxytocin 2 = 100,C0025663|C0023981|G0000000|C0008976|C1442061|C0043210|C3640815|C0007874|C1514756|C0442027|C0085174|C0450371|G0000000|G0000000|G0000000|C1442061|C0178602|G0000000|C0030095|G0000000|G0000000|C1442061
Group 1 (n = 100) received 25 g misoprostol (1/4 of a double-scored 100 g tablet) every 3 h (without concomitant food) to a maximum of six doses.,1 = 100 received 25 misoprostol 1/4 double-scored 100 tablet 3 concomitant food maximum doses,G0000000|G0000000|C1442061|C1514756|C0450371|C0085174|G0000000|C0205173|C1442061|C0039225|G0000000|C0521115|C0016452|C0806909|C0178602
"After a 4-week drug-free period, patients were randomized with minimization for ethnic origin, sex, age, and left ventricular hypertrophy to receive either candesartan (8 to 16 mg once daily) or atenolol (50 to 100 mg once daily).",4-week drug-free period patients randomized minimization ethnic origin sex age left ventricular hypertrophy receive candesartan 8 16 daily atenolol 50 100 daily,C0332174|C0678752|C0439531|C0030705|C0034656|G0000000|C0015031|C0079946|C0009253|C0001779|C0205091|C0018827|C0020564|C1514756|C0717550|G0000000|C0450371|C0332173|C0004147|C0450371|C1442061|C0332173
"Methods-We compared the treatment effects of an ARB (candesartan cilexetil)-based regimen and a -blocker (atenolol)-based regimen for 52 weeks on common carotid artery (CCA) and left ventricular structure in hypertensive patients in a randomized, double-blind study.",methods-we compared treatment effects arb candesartan cilexetil -based regimen -blocker atenolol -based regimen 52 weeks common carotid artery cca left ventricular structure hypertensive patients randomized double-blind study,C0025663|C1707455|C0039798|C1280500|C3888198|C0717550|G0000000|C1527178|C0040808|G0000000|C0004147|C1527178|C0040808|C0450371|C0439230|C0205214|C0741968|C0003842|C0220668|C0205091|C0018827|C0678594|C0857121|C0030705|C0034656|C0013072|C0557651
"Eighty-eight patients with uncontrolled essential hypertension (160/100 mm Hg untreated; 140/90 mm Hg on treatment  tonometry in the right common carotid artery (CCA) with an SPT-301 high-fidelity strain-gauge tonometer (Millar instruments Inc, Houston, Tex).",eighty-eight patients uncontrolled essential hypertension 160/100 mm hg untreated 140/90 mm hg treatment tonometry common carotid artery cca spt-301 high-fidelity strain-gauge tonometer millar instruments houston tex,C3816958|C0030705|C0205318|C0205224|C0020538|C1442061|G0000000|C0025424|C0332155|C1442061|G0000000|C0025424|C0039798|C0040420|C0205214|C0741968|C0003842|C0220668|C1442061|C0205250|C0080194|C0183969|G0000000|C0348000|G0000000|G0000000
"Hydrochlorothiazide (12.5 to 25 mg once daily), felodipine (5 to 10 mg once daily), and doxazosin (4 to 16 mg once daily) were added as required.",hydrochlorothiazide 12 5 25 daily felodipine 5 10 daily doxazosin 4 16 daily required,C0020261|C0450371|G0000000|C0450371|C0332173|C0015772|G0000000|C0450371|C0332173|C0114873|G0000000|C0450371|C0332173|C1514873
"Thus, while 100 mg oral misoprostol appeared more active than 25 mg by the intravaginal route (17), 50 mg oral doses were less effective than the 25 mg vaginal doses (6).",100 oral misoprostol appeared active 25 intravaginal route 17 50 oral doses effective 25 vaginal doses 6,C1442061|C0442027|C0085174|C0700364|C0205177|C0450371|C0442122|C0013153|C0450371|C0450371|C0442027|C0178602|C1280519|C0450371|C0042232|C0178602|G0000000
"Nursing staff helped to supervise and ensure that the patient took the medication every 4 h. At onset of labor, the patient was kept nil by mouth and given an intravenous infusion with two bottles of 500 ml dextrose 5% solution alternating with one bottle of 500 ml 0.9% normal saline solution every 6 h. Continuous fetal heart rate monitoring with CTG was started.",nursing staff helped supervise ensure patient medication 4 onset labor patient nil mouth intravenous infusion bottles 500 dextrose 5% solution alternating bottle 500 0 9% normal saline solution 6 continuous fetal heart rate monitoring ctg started,C0006147|C0851286|C1269765|G0000000|C0218063|C0030705|C0013227|G0000000|C0206132|C0022864|C0030705|C0442734|C0226896|C0348016|C0574032|C0179376|C1442061|C0017725|G0000000|C0037633|C0332270|C0179376|C1442061|G0000000|G0000000|C0205307|C0036082|C0037633|G0000000|C0549178|C0015965|C0018787|C0871208|C0150369|G0000000|C1272689
"The envelope contained the study drug (placebo, 50 mg or 100 mg misoprostol) for the subject.",envelope contained study drug placebo 50 100 misoprostol subject,C1622204|C0332256|C0557651|C0013227|C0032042|C0450371|C1442061|C0085174|C0681850
"Intracoronary cell injection was performed a median of 6 days (interquartile range, 5 to 6) after the acute PCI.",intracoronary cell injection performed median 6 days interquartile range 5 6 acute pci,C0595454|C0007634|C0021485|C0884358|C0549183|G0000000|C0439228|G0000000|C1514721|G0000000|G0000000|C0205178|C4049621
"The aspirate was centrifuged on a Ficoll density gradient to isolate the mononuclear cells, which were washed and resuspended in heparin-treated plasma.",aspirate centrifuged ficoll density gradient isolate mononuclear cells washed resuspended heparin-treated plasma,C0370199|C0179834|C0016071|C0178587|C0439182|C1875400|C1513475|C0007634|C1548982|G0000000|C0019134|C0032105
"After SPECT, echocardiography, and MRI were performed at 6 months, coronary angiography was carried out according to the standard protocol, resulting in PCI being performed for culpritlesion restenosis in eight patients in each group and coronary-artery bypass grafting being performed in two patients in the mononuclear BMC group and one in the control group.",spect echocardiography mri performed 6 months coronary angiography carried standard protocol pci performed culpritlesion restenosis patients coronary-artery bypass grafting performed patients mononuclear bmc control,C0040399|C0013516|C0024485|C0884358|G0000000|C0439231|C0018787|C0002978|C0206243|C1442989|C0442711|C4049621|C0884358|G0000000|C0333186|C0030705|C0205042|C0741847|C0332835|C0884358|C0030705|C1513475|C0065839|C0243148
Progenitor cells were isolated and enriched with the use of Ficoll-Hypaque centrifugation procedures.,progenitor cells isolated enriched ficoll-hypaque centrifugation procedures,C0870134|C0007634|C0205409|C0359583|C0016071|C0007703|C0025664
"At 4 months, paired left ventricular angiograms with adequate contrast opacification for quantitative analysis were available for 95 patients in the BMC group and 92 patients in the placebo group.",4 months paired left ventricular angiograms adequate contrast opacification quantitative analysis 95 patients bmc 92 patients placebo,G0000000|C0439231|C1709450|C0205091|C0018827|C0002978|C0205410|C0009924|C0449584|C0392762|C0002778|C0450371|C0030705|C0065839|C0450371|C0030705|C0032042
All patients underwent bone marrow aspiration 3 to 6 days after receiving reperfusion therapy for acute myocardial infarction.,patients underwent bone marrow aspiration 3 6 days receiving reperfusion therapy acute myocardial infarction,C0030705|G0000000|C0262950|C0086590|C0220787|G0000000|G0000000|C0439228|C1514756|C0035124|C0039798|C0205178|C0027061|C0021308
"In a multicenter trial, we randomly assigned 204 patients with acute myocardial infarction to receive an intracoronary infusion of progenitor cells derived from bone marrow (BMC) or placebo medium into the infarct artery 3 to 7 days after successful reperfusion therapy.",multicenter trial randomly assigned 204 patients acute myocardial infarction receive intracoronary infusion progenitor cells derived bone marrow bmc placebo medium infarct artery 3 7 days successful reperfusion therapy,C0439743|C0008976|G0000000|C1516050|C1442061|C0030705|C0205178|C0027061|C0021308|C1514756|C0595454|C0574032|C0870134|C0007634|C1441547|C0262950|C0086590|C0065839|C0032042|C0009458|C0021308|C0003842|G0000000|G0000000|C0439228|C0597535|C0035124|C0039798
Some patients took lipid-lowering drugs.,patients lipid-lowering drugs,C0030705|C0023779|C0013227
Patients of the main group received moderate-intensity PT.,patients main received moderate-intensity pt,C0030705|C0205225|C1514756|C0205081|C0699718
Patients were randomized into 2 groups in order of admittance (next but one): the main group (n=197) and the control group (n=195).,patients randomized 2 admittance main n=197 control n=195,C0030705|C0034656|G0000000|G0000000|C0205225|C0369718|C0243148|C0369718
Patients of the main group received moderate-intensity PT (50-60% of the performed capacity by bicycle ergometry (BE) test) 3 times per week with duration of exercises from 45 minutes to 1 hour during 1 year.,patients main received moderate-intensity pt 50-60% performed capacity bicycle ergometry test 3 times week duration exercises 45 minutes 1 hour 1,C0030705|C0205225|C1514756|C0205081|C0699718|C0450371|C0884358|C1516240|C0005375|C0085143|C0022885|G0000000|C0040223|C0332174|C0449238|C0015259|C0450371|C0439232|G0000000|C0439227|G0000000
"Patients received standard medical therapy which included beta-blocker, acetylsalicylic acid or other antithrombotic drug, as well as nitrate, and ACE inhibitor.",patients received standard medical therapy included beta-blocker acetylsalicylic acid antithrombotic drug nitrate ace inhibitor,C0030705|C1514756|C1442989|C0199168|C0039798|C0332257|C0001645|G0000000|C0001128|G0000000|C0013227|C0028125|C1452534|C1999216
"All patients received beta-blocker, nitrate, ACE inhibitors and acetylsalicylic acid.",patients received beta-blocker nitrate ace inhibitors acetylsalicylic acid,C0030705|C1514756|C0001645|C0028125|C1452534|C0243077|G0000000|C0001128
"These low-dose combinations include (ER-metoprolol/HCT): 25/12.5, 50/6.25, and 50/12.5 mg (Table 4).",low-dose combinations er-metoprolol/hct 25/12 5 50/6 25 50/12 5 table 4,C0445550|C0453882|C3810541|C0450371|G0000000|C0450371|C0450371|C0450371|G0000000|C0039224|G0000000
All 10 patients underwent a second cardiac catheterization 5 to 12 days after AMI (7 [2] days) where intracoronary infusion of MNBMCs into the infarcted area was performed.,10 patients underwent cardiac catheterization 5 12 days ami 7 2 days intracoronary infusion mnbmcs infarcted performed,C0450371|C0030705|G0000000|C0018787|C0007430|G0000000|C0450371|C0439228|G0000000|G0000000|G0000000|C0439228|C0595454|C0574032|G0000000|C0333541|C0884358
"In Group I, intracoronary infusion was carried out 7(2) days after AMI.",intracoronary infusion carried 7 2 days ami,C0595454|C0574032|C0206243|G0000000|G0000000|C0439228|G0000000
"Patients were randomly assigned to receive either an intracoronary infusion of autologous mononuclear bone marrow cells (Group I; n=10) or systemic administration of granulocyte colony-stimulating factor (G-CSF) (Group II; n=10), or to a control group (Group III; n=10).",patients randomly assigned receive intracoronary infusion autologous mononuclear bone marrow cells n=10 systemic administration granulocyte colony-stimulating factor g-csf ii n=10 control iii n=10,C0030705|G0000000|C1516050|C1514756|C0595454|C0574032|C0439859|C1513475|C0262950|C0086590|C0007634|C0369718|C0205373|C0001554|C0018183|C0439158|C1521761|C0079459|G0000000|C0369718|C0243148|C0439070|C0369718
Eligible patients were randomly assigned in a 2:1 ratio either to intracoronary BMNCs injection (n  17) or standard medical therapy (n  10).,eligible patients randomly assigned 2 1 ratio intracoronary bmncs injection 17 standard medical therapy 10,C1548635|C0030705|G0000000|C1516050|G0000000|G0000000|C0456603|C0595454|G0000000|C0021485|C0450371|C1442989|C0199168|C0039798|C0450371
He had a complicated PCI followed by coronary artery bypass grafting and died 2 weeks later from sepsis and acute respiratory distress syndrome.,complicated pci coronary artery bypass grafting died 2 weeks sepsis acute respiratory distress syndrome,C0231242|C4049621|C0018787|C0003842|C0741847|C0332835|C0011065|G0000000|C0439230|C0036690|C0205178|C0521346|C0231303|C0039082
"Patients were then randomly assigned to treatment with either Changes in right brachial artery diameter in response to reactive hyperemia were measured using highresolution ultrasound (Acuson 128XP/10 with a 7.0-MHz linear-array transducer, Mountain View, California) as previously described (12)(13)(14).",patients randomly assigned treatment brachial artery diameter response reactive hyperemia measured highresolution ultrasound acuson 128xp/10 7 0-mhz linear-array transducer mountain view california 12 13 14,C0030705|G0000000|C1516050|C0039798|C0445456|C0003842|C1301886|C0871261|C0205332|C0020452|C0444706|G0000000|C0041618|G0000000|C0450371|G0000000|C0556962|C0205132|C0040661|C0442533|C0449911|C0006754|C0450371|C0450371|C0450371
"After inclusion, the patients entered a period of 3-4 weeks with placebo treatment, during which the brachial artery measurements and subcutaneous biopsy were performed (see below).",inclusion patients entered period 3-4 weeks placebo treatment brachial artery measurements subcutaneous biopsy performed,C0007637|C0030705|C1521975|C0439531|G0000000|C0439230|C0032042|C0039798|C0445456|C0003842|C0242485|C0443315|C0005558|C0884358
Only three women in vaginal group developed abnormal uterine contractile patterns while no such event occurred in the oral group.,women vaginal developed abnormal uterine contractile patterns event occurred oral,C0043210|C0042232|G0000000|C0205161|C0042149|C0026820|C0449774|C0441471|C1709305|C0442027
"Inclusion criteria were (1) singleton gestation in a cephalic presentation, (2) reassuring fetal heart rate (FHR) pattern, (3) unfavorable cervix (was defined as Bishop score of < 6) next early morning (6 AM, day 1) for uterine contraction and reassuring fetal heart rate (FHR) pattern with external fetal monitoring and external tocodynamometry used for a 20-minute period.",inclusion criteria 1 singleton gestation cephalic presentation 2 reassuring fetal heart rate fhr pattern 3 unfavorable cervix defined bishop score < 6 morning 6 day 1 uterine contraction reassuring fetal heart rate fhr pattern external fetal monitoring external tocodynamometry 20-minute period,C0007637|C0243161|G0000000|C0481462|C0032961|C0205096|C0449450|G0000000|C0557055|C0015965|C0018787|C0871208|G0000000|C0449774|G0000000|C3640815|C0007874|C1704788|C1551458|C0449820|G0000000|G0000000|C0332170|G0000000|C0332173|G0000000|C0042149|C1140999|C0557055|C0015965|C0018787|C0871208|G0000000|C0449774|C0205101|C0015965|C0150369|C0205101|C0040345|C0450371|C0439531
